Entry	Reviewed	Entry Name	Protein names	Gene Names	Organism	Length
P84278	reviewed	PA2A_LITPA	Palustrin-2a		Lithobates palustris (Pickerel frog) (Rana palustris)	31
P84279	reviewed	RN2B_LITPA	Ranatuerin-2PL (Palustrin-2b)		Lithobates palustris (Pickerel frog) (Rana palustris)	31
P84280	reviewed	PA2C_LITPA	Palustrin-2c		Lithobates palustris (Pickerel frog) (Rana palustris)	31
P84281	reviewed	PA3A_LITPA	Palustrin-3a		Lithobates palustris (Pickerel frog) (Rana palustris)	48
P84282	reviewed	LECA_PHYAM	Lectin-A (PL-A)		Phytolacca americana (American pokeweed) (Phytolacca decandra)	64
P84382	reviewed	XT2_XENTR	Antimicrobial peptide 2 (XT-2)		Xenopus tropicalis (Western clawed frog) (Silurana tropicalis)	25
P84383	reviewed	XT3_XENTR	Antimicrobial peptide 3 (Levitide-like peptide) (XT-3)		Xenopus tropicalis (Western clawed frog) (Silurana tropicalis)	25
P84384	reviewed	XT4_XENTR	Antimicrobial peptide 4 (XT-4)		Xenopus tropicalis (Western clawed frog) (Silurana tropicalis)	22
P84387	reviewed	XT1_XENTR	Antimicrobial peptide 1 (XT-1)		Xenopus tropicalis (Western clawed frog) (Silurana tropicalis)	27
P84566	reviewed	PLS1_PITHY	Phylloseptin-H1 (PLS-H1) (Phylloseptin-1) (PS-1)	psn1 psn-1	Pithecopus hypochondrialis (Orange-legged leaf frog) (Phyllomedusa hypochondrialis)	19
P84568	reviewed	PLS3_PITHY	Phyllospetin-H3 (PLS-H3) (Phylloseptin-3) (PS-3)	psn3 psn-3	Pithecopus hypochondrialis (Orange-legged leaf frog) (Phyllomedusa hypochondrialis)	19
P84569	reviewed	PLS1_PITOR	Phylloseptin-O1 (PLS-O1) (Phylloseptin-4) (PS-4)	psn4 psn-4	Pithecopus oreades (Orange-legged leaf frog) (Phyllomedusa oreades)	20
P84570	reviewed	PLS2_PITOR	Phylloseptin-O2 (PLS-O2) (Phylloseptin-5) (PS-5)	psn5 psn-5	Pithecopus oreades (Orange-legged leaf frog) (Phyllomedusa oreades)	19
P84571	reviewed	PLS4_PITHY	Phyllospetin-H4 (PLS-H4) (Phylloseptin-6) (PS-6)	psn6 psn-6	Pithecopus hypochondrialis (Orange-legged leaf frog) (Phyllomedusa hypochondrialis)	17
P84597	reviewed	DRS1_PITHY	Dermaseptin-H1 (DRS-H1) (DShypo 02) (Dermaseptin-H4) (DRS-H4)		Pithecopus hypochondrialis (Orange-legged leaf frog) (Phyllomedusa hypochondrialis)	76
P84599	reviewed	DRS6_PITHY	Dermaseptin-H6 (DRS-H6) (DShypo 04)		Pithecopus hypochondrialis (Orange-legged leaf frog) (Phyllomedusa hypochondrialis)	33
P84600	reviewed	DRS7_PITHY	Dermaseptin-H7 (DRS-H7) (DShypo 05)		Pithecopus hypochondrialis (Orange-legged leaf frog) (Phyllomedusa hypochondrialis)	29
P84601	reviewed	DRS8_PITHY	Dermaseptin-H8 (DRS-H8) (DShypo 06)		Pithecopus hypochondrialis (Orange-legged leaf frog) (Phyllomedusa hypochondrialis)	33
P84839	reviewed	BR1E_PELSA	Brevinin-1E		Pelophylax saharicus (Sahara frog) (Rana saharica)	24
P84840	reviewed	ES1_PELSA	Esculentin-1		Pelophylax saharicus (Sahara frog) (Rana saharica)	46
P84841	reviewed	ES1B_PELSA	Esculentin-1B		Pelophylax saharicus (Sahara frog) (Rana saharica)	46
P84842	reviewed	BR2C_PELSA	Brevinin-2Ec		Pelophylax saharicus (Sahara frog) (Rana saharica)	34
P84858	reviewed	TPH_SYLGU	Temporin-GH (AMP-5)		Sylvirana guentheri (Gunther's frog) (Rana guentheri)	13
P84860	reviewed	BR2A_SYLGU	Brevinin-2GHa (AMP-1)		Sylvirana guentheri (Gunther's frog) (Rana guentheri)	34
P84927	reviewed	DRS7_PHYTS	Dermaseptin-TA1 (DRS-TA1) (Dermaseptin-7) (DStar 07)		Phyllomedusa tarsius (Brownbelly leaf frog) (Phyllomedusa tarsia)	31
P84936	reviewed	DMS6_PITAZ	Dermaseptin-H6 (Dermaseptin-H1) (Dermaseptin-like peptide 1) (DMS1) (Dermaseptin-like peptide 6) (DMS6)		Pithecopus azureus (Orange-legged monkey tree frog) (Phyllomedusa azurea)	29
P84938	reviewed	PLS5_PITAZ	Phylloseptin-Az5 (PLS-Az5) (Phylloseptin-13) (PS-13)	psn13 psn-13	Pithecopus azureus (Orange-legged monkey tree frog) (Phyllomedusa azurea)	19
P84939	reviewed	PLS6_PITAZ	Phylloseptin-Az6 (PLS-Az6) (Phylloseptin-14) (PS-14)	psn14 psn-14	Pithecopus azureus (Orange-legged monkey tree frog) (Phyllomedusa azurea)	19
P84954	reviewed	HPS1_PITAZ	Hyposin-H1 (HPS-H1) (Hyposin-1) (Hyposin-HA1)		Pithecopus azureus (Orange-legged monkey tree frog) (Phyllomedusa azurea)	11
P84955	reviewed	HPS2_PITAZ	Hyposin-H2 (HPS-H2) (Hyposin-2) (Hyposin-HA2)		Pithecopus azureus (Orange-legged monkey tree frog) (Phyllomedusa azurea)	11
P84956	reviewed	HPS4_PITAZ	Hyposin-H4 (HPS-H4) (Hyposin-3) (Hyposin-HA3)		Pithecopus azureus (Orange-legged monkey tree frog) (Phyllomedusa azurea)	12
P84957	reviewed	HPS5_PITAZ	Hyposin-H5 (HPS-H5) (Hyposin-4) (Hyposin-HA4)		Pithecopus azureus (Orange-legged monkey tree frog) (Phyllomedusa azurea)	14
P85881	reviewed	PLS1_PITAZ	Phylloseptin-Az1 (PLS-Az1) (Phylloseptin-2) (PS-2)		Pithecopus azureus (Orange-legged monkey tree frog) (Phyllomedusa azurea)	63
P85883	reviewed	PLS3_PITAZ	Phylloseptin-Az3 (PLS-Az3) (Phylloseptin-8) (PS-8)		Pithecopus azureus (Orange-legged monkey tree frog) (Phyllomedusa azurea)	66
P86415	reviewed	HALCY_HALPP	Halocyntin		Halocynthia papillosa (Red sea-squirt)	26
P86473	reviewed	CHIT_ACTCC	Endochitinase (EC 3.2.1.14)	CEY00_Acc04863	Actinidia chinensis var. chinensis (Chinese soft-hair kiwi)	322
P86521	reviewed	AMP_LYMAR	Antimicrobial peptide 1b (LAMP-1b) [Cleaved into: Antimicrobial peptide 1a (LAMP-1a)]		Leymus arenarius (Lyme grass) (Elymus arenarius)	44
P86527	reviewed	NLTP1_NIGSA	Non-specific lipid-transfer protein 1 (LTP 1)		Nigella sativa (Black cumin)	35
P86705	reviewed	AMP1_COCNU	Antimicrobial peptide 1 (Cn-AMP1)		Cocos nucifera (Coconut palm)	9
P86706	reviewed	AMP2_COCNU	Antimicrobial peptide 2 (Cn-AMP2)		Cocos nucifera (Coconut palm)	11
P86707	reviewed	AMP3_COCNU	Antimicrobial peptide 3 (Cn-AMP3)		Cocos nucifera (Coconut palm)	8
P86915	reviewed	PSB_PSEBL	Pseudin-B		Pseudis bolbodactyla (Frog)	23
P86941	reviewed	DRS1_AGASP	Dermaseptin-SP1 (DRS-SP1) (Dermaseptin-LI1) (DRS-LI1) (Insulinotropic peptide 1) (FSIP)		Agalychnis spurrelli (Gliding leaf frog) (Agalychnis litodryas)	28
Q09022	reviewed	XEN1_XENLA	Xenoxin-1	xenoxin-1	Xenopus laevis (African clawed frog)	84
Q0JF21	reviewed	AGI_ORYSJ	Lectin (Agglutinin) [Cleaved into: Lectin 10 kDa peptide; Lectin 8 kDa peptide]	Os04g0173800 LOC_Os04g09390 OSJNBb0015C06.8	Oryza sativa subsp. japonica (Rice)	227
Q0VZ41	reviewed	PLS6_PITHY	Phylloseptin-H6 (PLS-H6) (Phylloseptin-8) (PS-8)	psn-8	Pithecopus hypochondrialis (Orange-legged leaf frog) (Phyllomedusa hypochondrialis)	66
Q1JS87	reviewed	ES1VB_ODOVE	Esculentin-1Vb (esc1Vb) (Esculentin 1VEb)		Odorrana versabilis (Chinese bamboo leaf odorous frog) (Rana versabilis)	84
Q1JS88	reviewed	PA3B_ODOVE	Palustrin-3b (pal3b)		Odorrana versabilis (Chinese bamboo leaf odorous frog) (Rana versabilis)	86
Q1JS89	reviewed	ES2VB_ODOVE	Esculentin-2Vb (esc2Vb) (Esculentin 2VEb)		Odorrana versabilis (Chinese bamboo leaf odorous frog) (Rana versabilis)	78
Q1JS90	reviewed	RN2B_ODOVE	Ranatuerin-2Vb (ranat2Vb) (2VEb)		Odorrana versabilis (Chinese bamboo leaf odorous frog) (Rana versabilis)	67
Q1JS91	reviewed	TP1_ODOVE	Temporin-1V (temp1v) (1VE)		Odorrana versabilis (Chinese bamboo leaf odorous frog) (Rana versabilis)	62
Q1JS92	reviewed	RN2A_ODOVE	Ranatuerin-2Va (ranat2Va) (2VEa)		Odorrana versabilis (Chinese bamboo leaf odorous frog) (Rana versabilis)	71
Q1JS93	reviewed	BR1B_ODOVE	Brevinin-1Vb (brevIVB) (1VEb)		Odorrana versabilis (Chinese bamboo leaf odorous frog) (Rana versabilis)	70
Q1JS94	reviewed	PA1C_ODOVE	Palustrin-1c (pal1c)		Odorrana versabilis (Chinese bamboo leaf odorous frog) (Rana versabilis)	68
Q2FZW4	reviewed	DLTC_STAA8	D-alanyl carrier protein (DCP) (D-alanine--poly(phosphoribitol) ligase subunit 2)	dltC SAOUHSC_00871	Staphylococcus aureus (strain NCTC 8325 / PS 47)	78
Q2G0D9	reviewed	GRAS_STAA8	Sensor histidine kinase GraS (EC 2.7.13.3) (Glycopeptide resistance-associated protein S)	graS SAOUHSC_00666	Staphylococcus aureus (strain NCTC 8325 / PS 47)	346
Q2IAL6	reviewed	CTHL3_CHICK	Cathelicidin-3 (CATH-3) (Fowlicidin-3)	CATHL3	Gallus gallus (Chicken)	151
Q3V5J7	unreviewed	Q3V5J7_CAEEL	Phospholipase A2 (EC 3.1.1.4)	CELE_Y69A2AL.2 Y69A2AL.2	Caenorhabditis elegans	157
Q58T39	reviewed	M1015_BOMMX	Maximins 10/H15 [Cleaved into: Maximin-10; Maximin-H15]		Bombina maxima (Giant fire-bellied toad) (Chinese red belly toad)	144
Q58T51	reviewed	M1111_BOMMX	Maximins 11/H11 [Cleaved into: Maximin-11; Maximin-H11]		Bombina maxima (Giant fire-bellied toad) (Chinese red belly toad)	144
Q58T56	reviewed	M8H7_BOMMX	Maximins 8/H7 [Cleaved into: Maximin-8; Maximin-H7]		Bombina maxima (Giant fire-bellied toad) (Chinese red belly toad)	144
Q58T58	reviewed	M7H13_BOMMX	Maximins 7/H13 [Cleaved into: Maximin-7; Maximin-H13]		Bombina maxima (Giant fire-bellied toad) (Chinese red belly toad)	144
Q58T59	reviewed	M6H10_BOMMX	Maximins 6/H10 [Cleaved into: Maximin-6; Maximin-H10]		Bombina maxima (Giant fire-bellied toad) (Chinese red belly toad)	144
Q58T72	reviewed	M7H6_BOMMX	Maximins 7/H6 [Cleaved into: Maximin-7; Maximin-H6]		Bombina maxima (Giant fire-bellied toad) (Chinese red belly toad)	144
Q58T93	reviewed	MYH16_BOMMX	Maximins y/H16 [Cleaved into: Maximin-y; Maximin-H16]		Bombina maxima (Giant fire-bellied toad) (Chinese red belly toad)	142
Q58T95	reviewed	MYH11_BOMMX	Maximins y/H11 [Cleaved into: Maximin-y; Maximin-H11]		Bombina maxima (Giant fire-bellied toad) (Chinese red belly toad)	142
Q5DVA6	reviewed	PLX1_PHYSA	Phylloxin-S1 (PLX-S1) (Phylloxin)	PLX-S	Phyllomedusa sauvagei (Sauvage's leaf frog)	64
Q5HI08	reviewed	GRAS_STAAC	Sensor histidine kinase GraS (EC 2.7.13.3) (Glycopeptide resistance-associated protein S)	graS SACOL0717	Staphylococcus aureus (strain COL)	346
Q5HI09	reviewed	GRAR_STAAC	Response regulator protein GraR (Glycopeptide resistance-associated protein R)	graR SACOL0716	Staphylococcus aureus (strain COL)	224
Q63471	reviewed	BPIA2_RAT	BPI fold-containing family A member 2 (Neonatal submandibular gland protein) (Parotid secretory protein) (PSP)	Bpifa2 Psp	Rattus norvegicus (Rat)	235
Q6IV20	reviewed	GLL11_CHICK	Gallinacin-11 (Gal-11) (Beta-defensin 11) (Vitelline membrane outer layer protein 2) (Vitelline membrane outer layer protein II) (VMO-II) (VMOII)	GAL11	Gallus gallus (Chicken)	104
Q75GX9	reviewed	GLB63_ORYSJ	63 kDa globulin-like protein (allergen Ory s GLP63)	Os03g0663800 LOC_Os03g46100 OSJNBa0034D21.12	Oryza sativa subsp. japonica (Rice)	562
Q7A5R9	reviewed	MPRF_STAAN	Phosphatidylglycerol lysyltransferase (EC 2.3.2.3) (Lysylphosphatidylglycerol synthase) (LPG synthase) (Multiple peptide resistance factor)	mprF SA1193	Staphylococcus aureus (strain N315)	840
Q7A6Z3	reviewed	GRAS_STAAN	Sensor protein kinase GraS (EC 2.7.13.3) (Glycopeptide resistance-associated protein S)	graS SA0615	Staphylococcus aureus (strain N315)	346
Q7T3K7	reviewed	DRS8_PHYSA	Dermaseptin-S8 (DRS-S8) (Dermaseptin DS VIII)		Phyllomedusa sauvagei (Sauvage's leaf frog)	79
Q7T3K8	reviewed	DRS7_PHYSA	Dermaseptin-S7 (DRS-S7) (Dermaseptin DS VII)		Phyllomedusa sauvagei (Sauvage's leaf frog)	76
Q7T3K9	reviewed	DRS6_PHYSA	Dermaseptin-S6 (DRS-S6) (Dermaseptin DS VI)		Phyllomedusa sauvagei (Sauvage's leaf frog)	81
Q800R3	reviewed	PLS1_PHYBI	Phylloseptin-B1 (PLS-B1) (Dermaseptin PBN1) (DRP-PBN1)		Phyllomedusa bicolor (Two-colored leaf frog) (Rana bicolor)	66
Q800R9	reviewed	CR1B_RANCA	Caerin 1.11		Ranoidea caerulea (Green tree frog) (Litoria caerulea)	75
Q86LE4	reviewed	DEFI_RHIMP	Defensin		Rhipicephalus microplus (Cattle tick) (Boophilus microplus)	74
Q8GUD7	reviewed	CHIL_HEVBR	Probable inactive chitinase-like protein LaCIC (Leaf class I chitinase) (LaCIC) (allergen Hev b 11)	LACIC	Hevea brasiliensis (Para rubber tree) (Siphonia brasiliensis)	295
Q8NFQ5	reviewed	BPIB6_HUMAN	BPI fold-containing family B member 6 (Bactericidal/permeability-increasing protein-like 3)	BPIFB6 BPIL3	Homo sapiens (Human)	453
Q90ZY0	reviewed	PLE2_PSEAM	Pleurocidin	ple2	Pseudopleuronectes americanus (Winter flounder) (Pleuronectes americanus)	68
Q932F1	reviewed	GRAR_STAAM	Response regulator protein GraR (Glycopeptide resistance-associated protein R)	graR SAV0659	Staphylococcus aureus (strain Mu50 / ATCC 700699)	224
Q962A7	reviewed	PEN4D_PENST	Penaeidin-4d (Pen-4d)		Penaeus setiferus (Atlantic white shrimp) (Litopenaeus setiferus)	67
Q969E1	reviewed	LEAP2_HUMAN	Liver-expressed antimicrobial peptide 2 (LEAP-2)	LEAP2	Homo sapiens (Human)	77
Q99VW1	reviewed	GRAS_STAAM	Sensor histidine kinase GraS (EC 2.7.13.3) (Glycopeptide resistance-associated protein S)	graS SAV0660	Staphylococcus aureus (strain Mu50 / ATCC 700699)	346
Q9AVB0	reviewed	LECB_PHYAM	Lectin-B (PL-B)		Phytolacca americana (American pokeweed) (Phytolacca decandra)	361
Q9HV32	reviewed	PMRA_PSEAE	Response regulator protein PmrA	pmrA PA4776	Pseudomonas aeruginosa (strain ATCC 15692 / DSM 22644 / CIP 104116 / JCM 14847 / LMG 12228 / 1C / PRS 101 / PAO1)	221
Q9I4F9	reviewed	PHOP_PSEAE	Two-component response regulator PhoP	phoP PA1179	Pseudomonas aeruginosa (strain ATCC 15692 / DSM 22644 / CIP 104116 / JCM 14847 / LMG 12228 / 1C / PRS 101 / PAO1)	225
Q9SPL4	reviewed	AMP22_MACIN	Vicilin-like antimicrobial peptides 2-2 (MiAMP2) [Cleaved into: Antimicrobial peptide 2a (Antimicrobial peptide Mac i 1) (MiAMP2a); Antimicrobial peptide 2b (MiAMP2b); Antimicrobial peptide 2c-1 (MiAMP2c-1); Antimicrobial peptide 2c-2 (MiAMP2c-2); Antimicrobial peptide 2c-3 (MiAMP2c-3); Antimicrobial peptide 2d (MiAMP2d)]	AMP2-2	Macadamia integrifolia (Macadamia nut)	666
Q9SQF7	unreviewed	Q9SQF7_BRAJU	chitinase (EC 3.2.1.14)		Brassica juncea (Indian mustard) (Sinapis juncea)	400
R4JQZ0	reviewed	NDB4K_PANIM	Pantinin-2 (Non-disulfide-bridged peptide 4.21) (NDBP-4.21) (Non-disulfide-bridged peptide 5.22) (NDBP-5.22)		Pandinus imperator (Emperor scorpion)	68
A0A0R4I979	unreviewed	A0A0R4I979_BRABE	Peptidoglycan recognition protein 3 (EC 3.5.1.28)		Branchiostoma belcheri tsingtauense	236
A0A193H2U2	reviewed	CZS4_CRUCA	Cruzioseptin-4 (CZS-4)		Cruziohyla calcarifer (Splendid leaf frog) (Agalychnis calcarifer)	28
A0A193H356	reviewed	CZS5_CRUCA	Cruzioseptin-5 (CZS-5)		Cruziohyla calcarifer (Splendid leaf frog) (Agalychnis calcarifer)	34
A0A1P8AME8	unreviewed	A0A1P8AME8_ARATH	chitinase (EC 3.2.1.14)	At1g56680 F25P12.88 F25P12_88	Arabidopsis thaliana (Mouse-ear cress)	303
A0A804M5E1	unreviewed	A0A804M5E1_MAIZE	Cupin type-1 domain-containing protein	LOC542382	Zea mays (Maize)	439
A0A804ME60	unreviewed	A0A804ME60_MAIZE	chitinase (EC 3.2.1.14)		Zea mays (Maize)	278
A0A804PDB7	unreviewed	A0A804PDB7_MAIZE	chitinase (EC 3.2.1.14)	LOC100283208	Zea mays (Maize)	282
A0A804PDW1	unreviewed	A0A804PDW1_MAIZE	chitinase (EC 3.2.1.14)		Zea mays (Maize)	193
A0A804PV51	unreviewed	A0A804PV51_MAIZE	chitinase (EC 3.2.1.14)		Zea mays (Maize)	379
A0A804QLA1	unreviewed	A0A804QLA1_MAIZE	chitinase (EC 3.2.1.14)	LOC100284192	Zea mays (Maize)	357
A0A804UFZ2	unreviewed	A0A804UFZ2_MAIZE	chitinase (EC 3.2.1.14)	LOC103635126	Zea mays (Maize)	268
A6LE66	unreviewed	A6LE66_PARD8	Aminopeptidase	BDI_2249	Parabacteroides distasonis (strain ATCC 8503 / DSM 20701 / CIP 104284 / JCM 5825 / NCTC 11152)	405
A8I0L8	reviewed	THMAC_HIRME	Theromacin		Hirudo medicinalis (Medicinal leech)	75
C0HJX9	reviewed	DIP_CALVI	Diptericin		Calliphora vicina (Blue blowfly) (Calliphora erythrocephala)	42
C0HJY0	reviewed	PRP_CALVI	Proline-rich peptide		Calliphora vicina (Blue blowfly) (Calliphora erythrocephala)	22
C0HK08	reviewed	CZS10_CRUCA	Cruzioseptin-10 (CZS-10)		Cruziohyla calcarifer (Splendid leaf frog) (Agalychnis calcarifer)	28
C0HK09	reviewed	CZS13_CRUCA	Cruzioseptin-13 (CZS-13)		Cruziohyla calcarifer (Splendid leaf frog) (Agalychnis calcarifer)	25
C0HK10	reviewed	CZS14_CRUCA	Cruzioseptin-14 (CZS-14)		Cruziohyla calcarifer (Splendid leaf frog) (Agalychnis calcarifer)	27
C0HK11	reviewed	CZS15_CRUCA	Cruzioseptin-15 (CZS-15)		Cruziohyla calcarifer (Splendid leaf frog) (Agalychnis calcarifer)	20
C0HK83	reviewed	MAGB1_XENBO	Magainin-B1		Xenopus borealis (Kenyan clawed frog)	21
C0HK85	reviewed	XPFB1_XENBO	Xenoposin-precursor fragment B1 (XPF-B1)		Xenopus borealis (Kenyan clawed frog)	24
C0HK86	reviewed	XPFB2_XENBO	Xenoposin precursor fragment B2 (XPF-B2)		Xenopus borealis (Kenyan clawed frog)	24
C0HK90	reviewed	CPFB3_XENBO	Caerulein precursor fragment B3 (CPF-B3)		Xenopus borealis (Kenyan clawed frog)	22
C0HK91	reviewed	CPFB4_XENBO	Caerulein precursor fragment B4 (CPF-B4)		Xenopus borealis (Kenyan clawed frog)	24
C0HM80	reviewed	NLTP3_NIGSA	Non-specific lipid-transfer protein 3 (NsLTP3)		Nigella sativa (Black cumin)	25
C6L245	unreviewed	C6L245_PIG	trypsin (EC 3.4.21.4)	try PRSS2	Sus scrofa (Pig)	247
E1AXF9	reviewed	APMT1_AMOMA	Amolopin-p-MT1		Amolops mantzorum (Sichuan torrent frog)	62
E1B243	reviewed	E2MT3_AMOMA	Esculentin-2MT3		Amolops mantzorum (Sichuan torrent frog)	76
E1B247	reviewed	TP5_AMOMA	Temporin-MT5		Amolops mantzorum (Sichuan torrent frog)	60
E1B248	reviewed	TP3_AMOMA	Temporin-MT3		Amolops mantzorum (Sichuan torrent frog)	61
F1NLZ2	unreviewed	F1NLZ2_CHICK	Chromogranin-A	CHGA	Gallus gallus (Chicken)	466
G3MXK8	unreviewed	G3MXK8_BOVIN	Proteinase 3	PRTN3	Bos taurus (Bovine)	256
H9G2Z8	unreviewed	H9G2Z8_CAEEL	BPI1 domain-containing protein	CELE_F10D11.6 F10D11.6	Caenorhabditis elegans	817
J3KNB4	unreviewed	J3KNB4_HUMAN	Cathelicidin antimicrobial peptide	CAMP hCG_18336	Homo sapiens (Human)	173
M0R485	unreviewed	M0R485_RAT	Peptidoglycan recognition protein 2	Pglyrp2 LOC299567	Rattus norvegicus (Rat)	522
O18492	reviewed	CLAVE_STYCL	Clavanin-E		Styela clava (Sea squirt)	80
O93223	reviewed	DRS3_AGAAN	Dermaseptin-A3 (DRS-A3) (Dermaseptin AA-3-1)		Agalychnis annae (Blue-sided leaf frog) (Phyllomedusa annae)	75
O93224	reviewed	DRS4_AGAAN	Dermaseptin-A4 (DRS-A4) (Dermaseptin AA-3-3)		Agalychnis annae (Blue-sided leaf frog) (Phyllomedusa annae)	72
O93226	reviewed	DRS5_AGAAN	Dermaseptin-A5 (DRS-A5) (Dermaseptin AA-3-6) (Dermaseptin-A4) (DRS-A4)		Agalychnis annae (Blue-sided leaf frog) (Phyllomedusa annae)	80
O93453	reviewed	DRS3_AGADC	Dermaseptin-DA3 (DRS-DA3) (Dermaseptin PD-3-3)		Agalychnis dacnicolor (Giant Mexican leaf frog) (Pachymedusa dacnicolor)	80
P07468	reviewed	DEF2_RABIT	Corticostatin-2 (Antiadrenocorticotropin peptide II) (Corticostatin II) (CS-II) (Microbicidal peptide NP-3B) (Neutrophil antibiotic peptide NP-3B)		Oryctolagus cuniculus (Rabbit)	34
P0ADR2	reviewed	YGDD_ECOLI	UPF0382 inner membrane protein YgdD	ygdD b2807 JW2778	Escherichia coli (strain K12)	131
P0C008	reviewed	NIGR1_PELNI	Nigrocin-1		Pelophylax nigromaculatus (Black-spotted frog) (Rana nigromaculata)	33
P0C009	reviewed	NIGR2_PELNI	Nigrocin-2		Pelophylax nigromaculatus (Black-spotted frog) (Rana nigromaculata)	21
P0C2U9	reviewed	LYC34_LYCSI	U1-lycotoxin-Ls1a (U1-LCTX-Ls1a) (Peptide 2034)		Lycosa singoriensis (Wolf spider) (Aranea singoriensis)	19
P0CJ26	reviewed	ASCA2_ASCTR	Ascaphin-2		Ascaphus truei (Coastal tailed frog)	24
P0CJ28	reviewed	ASCA4_ASCTR	Ascaphin-4		Ascaphus truei (Coastal tailed frog)	24
P0CJ30	reviewed	ASCA6_ASCTR	Ascaphin-6		Ascaphus truei (Coastal tailed frog)	24
P0DMI8	reviewed	NDB32_HETSP	Antimicrobial peptide HsAp2		Heterometrus spinifer (Asia giant forest scorpion) (Malaysian black scorpion)	74
P0DTD6	reviewed	DRS1_AGALE	Dermaseptin-L1 (DRS-L1)		Agalychnis lemur (Lemur leaf frog) (Hylomantis lemur)	32
P0DUG2	reviewed	AMP1_ACRMI	Antimicrobial peptide AmAMP1		Acropora millepora (Staghorn coral) (Heteropora millepora)	117
P0DY15	reviewed	NDB23_SCOPA	Antimicrobial peptide Smp43		Scorpio palmatus (Israeli golden scorpion) (Scorpio maurus palmatus)	82
P0DY17	reviewed	NDB43_SCOPA	Peptide Smp13		Scorpio palmatus (Israeli golden scorpion) (Scorpio maurus palmatus)	68
P0DY20	reviewed	EQA_ACTEQ	Equinin A		Actinia equina (Beadlet anemone)	27
P0DY21	reviewed	EQB_ACTEQ	Equinin B		Actinia equina (Beadlet anemone)	71
P21227	reviewed	CHIB_PEA	Endochitinase B (EC 3.2.1.14)		Pisum sativum (Garden pea) (Lathyrus oleraceus)	23
P32413	reviewed	BR2_PELLE	Brevinin-2E		Pelophylax lessonae (Pool frog) (Rana lessonae)	33
P32423	reviewed	BR1_PELPV	Brevinin-1		Pelophylax porosus brevipodus (Nagoya Daruma pond frog) (Rana brevipoda porosa)	24
P32424	reviewed	BR2_PELPV	Brevinin-2		Pelophylax porosus brevipodus (Nagoya Daruma pond frog) (Rana brevipoda porosa)	33
P39080	reviewed	PGQ_XENLA	Antimicrobial peptide PGQ (Preproprotein pGQ)	pgq	Xenopus laevis (African clawed frog)	24
P40839	reviewed	BR2C_PELLE	Brevinin-2Ec		Pelophylax lessonae (Pool frog) (Rana lessonae)	34
P55788	reviewed	THAN_PODMA	Thanatin		Podisus maculiventris (Spined soldier bug) (Pentatoma maculiventris)	21
P56685	reviewed	BUTH_ANDAU	Buthinin		Androctonus australis (Sahara scorpion)	34
P56686	reviewed	DEF4_ANDAU	4 kDa defensin		Androctonus australis (Sahara scorpion)	37
P56924	reviewed	MLP_RANTE	Melittin-like peptide (MLP)		Rana temporaria (European common frog)	22
P80278	reviewed	DRS2_PHYSA	Dermaseptin-S2 (DRS-S2) (Dermaseptin II) (DS II) (Dermaseptin-2) (DS2)		Phyllomedusa sauvagei (Sauvage's leaf frog)	34
P80281	reviewed	DRS5_PHYSA	Dermaseptin-S5 (DRS-S5) (Dermaseptin V) (DS V) (Dermaseptin-5) (DS5)		Phyllomedusa sauvagei (Sauvage's leaf frog)	29
P80359	reviewed	HEVP_HEVBR	Pseudo-hevein (Minor hevein)		Hevea brasiliensis (Para rubber tree) (Siphonia brasiliensis)	45
P80389	reviewed	AMP1_CHICK	Antimicrobial peptide CHP1 (Chicken heterophil peptide 1)		Gallus gallus (Chicken)	39
P80393	reviewed	AMP3_MELGA	Antimicrobial peptide THP3 (Turkey heterophil peptide 3)		Meleagris gallopavo (Wild turkey)	25
P80711	reviewed	CLAVB_STYCL	Clavanin-B		Styela clava (Sea squirt)	23
P80954	reviewed	RUGA_GLARU	Rugosin-A		Glandirana rugosa (Japanese wrinkled frog) (Rana rugosa)	33
P80955	reviewed	RUGB_GLARU	Rugosin-B		Glandirana rugosa (Japanese wrinkled frog) (Rana rugosa)	33
P80956	reviewed	RUGC_GLARU	Rugosin-C		Glandirana rugosa (Japanese wrinkled frog) (Rana rugosa)	37
P81469	reviewed	STYA_STYCL	Styelin-A		Styela clava (Sea squirt)	20
P81470	reviewed	STYB_STYCL	Styelin-B		Styela clava (Sea squirt)	20
P81610	reviewed	DEFA_MYTED	Defensin-A		Mytilus edulis (Blue mussel)	37
P81611	reviewed	DEFB_MYTED	Defensin-B		Mytilus edulis (Blue mussel)	35
P81614	reviewed	MYMY_MYTED	Mytimycin		Mytilus edulis (Blue mussel)	33
P81729	reviewed	CHAL_BRARR	Chitin-binding allergen Bra r 2 (allergen Bra r 2)		Brassica rapa subsp. rapa (Turnip)	91
P82232	reviewed	BR1_RANTE	Brevinin-1T		Rana temporaria (European common frog)	20
P82234	reviewed	BR2C_RANTE	Brevinin-2Tc		Rana temporaria (European common frog)	29
P82235	reviewed	BR2D_RANTE	Brevinin-2Td		Rana temporaria (European common frog)	29
P82269	reviewed	BR2B_RANTE	Brevinin-2Tb		Rana temporaria (European common frog)	74
P82741	reviewed	RN2X1_AQUCT	Ranatuerin-1		Aquarana catesbeiana (American bullfrog) (Rana catesbeiana)	25
P82742	reviewed	RN2X2_AQUCT	Ranatuerin-2		Aquarana catesbeiana (American bullfrog) (Rana catesbeiana)	31
P82780	reviewed	RN2X3_AQUCT	Ranatuerin-3		Aquarana catesbeiana (American bullfrog) (Rana catesbeiana)	32
P82819	reviewed	RN2X4_AQUCT	Ranatuerin-4		Aquarana catesbeiana (American bullfrog) (Rana catesbeiana)	24
P82820	reviewed	TP5_AQUCT	Ranatuerin-5 (Temporin)		Aquarana catesbeiana (American bullfrog) (Rana catesbeiana)	12
P82821	reviewed	TP6_AQUCT	Ranatuerin-6 (Temporin)		Aquarana catesbeiana (American bullfrog) (Rana catesbeiana)	13
P82822	reviewed	TP7_AQUCT	Ranatuerin-7 (Temporin)		Aquarana catesbeiana (American bullfrog) (Rana catesbeiana)	13
P82823	reviewed	TP8_AQUCT	Ranatuerin-8 (Temporin)		Aquarana catesbeiana (American bullfrog) (Rana catesbeiana)	13
P82824	reviewed	TP9_AQUCT	Ranatuerin-9 (Temporin)		Aquarana catesbeiana (American bullfrog) (Rana catesbeiana)	14
P83086	reviewed	MHT_BOMMX	Maximin-Ht (Maximin-7)		Bombina maxima (Giant fire-bellied toad) (Chinese red belly toad)	20
P83087	reviewed	MHU_BOMMX	Maximin-Hu (Maximin-8)		Bombina maxima (Giant fire-bellied toad) (Chinese red belly toad)	20
P83640	reviewed	DRS3_PHYDS	Dermaseptin-DI3 (DRS-DI3) (Dermadistinctin-M) (DD M)		Phyllomedusa distincta (Monkey frog)	31
P83642	reviewed	DRS5_PHYDS	Dermaseptin-DI5 (DRS-DI5) (Dermadistinctin-Q2) (DD Q2)		Phyllomedusa distincta (Monkey frog)	25
P84524	reviewed	AMP1_PITHY	Antimicrobial peptide 1		Pithecopus hypochondrialis (Orange-legged leaf frog) (Phyllomedusa hypochondrialis)	12
P84598	reviewed	DRS5_PITHY	Dermaseptin-H5 (DRS-H5) (DShypo 03)		Pithecopus hypochondrialis (Orange-legged leaf frog) (Phyllomedusa hypochondrialis)	34
P84859	reviewed	GUEN_SYLGU	Guentherin (AMP-3)		Sylvirana guentheri (Gunther's frog) (Rana guentheri)	26
P84880	reviewed	DRS9_PITHY	Dermaseptin-H9 (DRS-H9) (DShypo 07)		Pithecopus hypochondrialis (Orange-legged leaf frog) (Phyllomedusa hypochondrialis)	33
P84958	reviewed	HPS3_PITAZ	Hyposin-H3 (HPS-H3) (Hyposin-5) (Hyposin-HA5)		Pithecopus azureus (Orange-legged monkey tree frog) (Phyllomedusa azurea)	15
P86042	reviewed	BR2CB_RANDY	Brevinin-2CDYb		Rana dybowskii (Dybovsky's frog) (Korean brown frog)	33
P86416	reviewed	PAPIL_HALPP	Papillosin		Halocynthia papillosa (Red sea-squirt)	34
Q0JC38	unreviewed	Q0JC38_ORYSJ	chitinase (EC 3.2.1.14)	Os04g0493600 OSNPB_040493600	Oryza sativa subsp. japonica (Rice)	91
Q2G0E1	reviewed	GRAX_STAA8	Auxiliary protein GraX	graX SAOUHSC_00664	Staphylococcus aureus (strain NCTC 8325 / PS 47)	307
Q2V4I8	reviewed	DEF32_ARATH	Defensin-like protein 32	At1g35537 F15O4	Arabidopsis thaliana (Mouse-ear cress)	81
Q65MA9	unreviewed	Q65MA9_BACLD	Phosphatidylglycerol lysyltransferase (EC 2.3.2.3) (Lysylphosphatidylglycerol synthase)	yfiX mprF BL03028	Bacillus licheniformis (strain ATCC 14580 / DSM 13 / JCM 2505 / CCUG 7422 / NBRC 12200 / NCIMB 9375 / NCTC 10341 / NRRL NRS-1264 / Gibson 46)	850
Q6PP25	unreviewed	Q6PP25_9INFA	Hemagglutinin	HA	Influenza A virus (A/Kwangju/243/2002(H3N2))	550
Q6WSR8	unreviewed	Q6WSR8_PICAB	chitinase (EC 3.2.1.14)		Picea abies (Norway spruce) (Picea excelsa)	276
Q792Y9	unreviewed	Q792Y9_MOUSE	trypsin (EC 3.4.21.4)	Prss1l EG436523 Gm5771 trypsinogen	Mus musculus (Mouse)	245
Q792Z0	unreviewed	Q792Z0_MOUSE	trypsin (EC 3.4.21.4)	Prss3 Tcrb-V20 trypsinogen	Mus musculus (Mouse)	246
Q792Z1	unreviewed	Q792Z1_MOUSE	trypsin (EC 3.4.21.4)	Try10 Tcrb-V20 trypsinogen	Mus musculus (Mouse)	246
Q90VW7	reviewed	PLE3_PSEAM	Pleurocidin-like peptide WF3	ple3	Pseudopleuronectes americanus (Winter flounder) (Pleuronectes americanus)	61
