Entry	Reviewed	Entry Name	Protein names	Gene Names	Organism	Length
Q16552	reviewed	IL17_HUMAN	Interleukin-17A (IL-17) (IL-17A) (Cytotoxic T-lymphocyte-associated antigen 8) (CTLA-8)	IL17A CTLA8 IL17	Homo sapiens (Human)	155
Q16778	reviewed	H2B2E_HUMAN	Histone H2B type 2-E (H2B-clustered histone 21) (Histone H2B-GL105) (Histone H2B.q) (H2B/q)	H2BC21 H2BFQ HIST2H2BE	Homo sapiens (Human)	126
Q19572	reviewed	GPA12_CAEEL	Guanine nucleotide-binding protein alpha-12 subunit	gpa-12 F18G5.3	Caenorhabditis elegans	355
Q1ELU3	reviewed	LAT3A_LACTA	M-zodatoxin-Lt3a (M-ZDTX-Lt3a) (La47) (Latarcin-3a) (Ltc-3a)		Lachesana tarabaevi (Spider)	82
Q1ID47	reviewed	APRA_PSEE4	Metalloprotease AprA (EC 3.4.24.-)	aprA PSEEN1550	Pseudomonas entomophila (strain L48)	485
Q20977	reviewed	STATB_CAEEL	Signal transducer and activator of transcription b (Zinc finger protein STAT-B)	sta-2 stat-b F58E6.1	Caenorhabditis elegans	567
Q24307	reviewed	DIAP2_DROME	Death-associated inhibitor of apoptosis 2 (Apoptosis 2 inhibitor) (IAP homolog A) (IAP-like protein) (ILP) (dILP) (Inhibitor of apoptosis 2)	Diap2 DIHA Iap2 Ilp CG8293	Drosophila melanogaster (Fruit fly)	498
Q27591	reviewed	ITBN_DROME	Integrin beta-nu	Itgbn beta-nu betaInt-nu Itgbetanu CG1762	Drosophila melanogaster (Fruit fly)	799
Q29549	reviewed	CLUS_PIG	Clusterin (CP40) (Complement cytolysis inhibitor) (CLI) [Cleaved into: Clusterin beta chain; Clusterin alpha chain]	CLU	Sus scrofa (Pig)	446
Q3UP87	reviewed	ELNE_MOUSE	Neutrophil elastase (EC 3.4.21.37) (Elastase-2) (Leukocyte elastase)	Elane Ela2	Mus musculus (Mouse)	265
Q45585	reviewed	SIGW_BACSU	ECF RNA polymerase sigma factor SigW (ECF sigma factor SigW) (Alternative RNA polymerase sigma factor SigW) (RNA polymerase sigma-W factor) (Sigma-W factor)	sigW ybbL BSU01730	Bacillus subtilis (strain 168)	187
Q45588	reviewed	RSIW_BACSU	Anti-sigma-W factor RsiW (Regulator of SigW) (Sigma-W anti-sigma factor RsiW)	rsiW ybbM BSU01740	Bacillus subtilis (strain 168)	208
Q53705	reviewed	LYTS_STAA8	Sensor histidine kinase/phosphatase LytS (EC 2.7.13.3) (EC 3.1.3.-) (Autolysin sensor kinase)	lytS SAOUHSC_00230	Staphylococcus aureus (strain NCTC 8325 / PS 47)	584
Q5ANA3	reviewed	CDR1_CANAL	Pleiotropic ABC efflux transporter of multiple drugs CDR1 (Pleiotropic drug resistance protein CDR1)	CDR1 CAALFM_C305220WA CaO19.13421 CaO19.6000	Candida albicans (strain SC5314 / ATCC MYA-2876) (Yeast)	1501
Q5GC92	reviewed	MAXSB_BOMMX	Maximins-S type B/C [Cleaved into: Maximin-S1; Maximin-S3; Maximin-S5; Maximin-S2; Maximin-S4]		Bombina maxima (Giant fire-bellied toad) (Chinese red belly toad)	305
Q5NTA4	reviewed	CHI4_CRYJA	Endochitinase 4 (EC 3.2.1.14) (Chitinase class IV) (CJP-4) (allergen Cry j Chitinase)		Cryptomeria japonica (Japanese cedar) (Cupressus japonica)	281
Q60943	reviewed	I17RA_MOUSE	Interleukin-17 receptor A (IL-17 receptor A) (IL-17RA) (CD antigen CD217)	Il17ra Il17r	Mus musculus (Mouse)	864
Q62386	reviewed	IL17_MOUSE	Interleukin-17A (IL-17) (IL-17A) (Cytotoxic T-lymphocyte-associated antigen 8) (CTLA-8)	Il17a Ctla8 Il17	Mus musculus (Mouse)	158
Q63035	reviewed	NLRP6_RAT	NACHT, LRR and PYD domains-containing protein 6 (Angiotensin II/vasopressin receptor) (Non-angiotensin-vasopressin receptor) (Non-AVR) (PYRIN-containing APAF1-like protein 5-like)	Nlrp6 Nalp6 Navr Pypaf5	Rattus norvegicus (Rat)	881
Q6QLQ5	reviewed	CTHL1_CHICK	Cathelicidin-1 (CATH-1) (Fowlicidin-1)	CATHL1 CATH	Gallus gallus (Chicken)	148
Q6UW15	reviewed	REG3G_HUMAN	Regenerating islet-derived protein 3-gamma (REG-3-gamma) (Pancreatitis-associated protein 1B) (PAP-1B) (Pancreatitis-associated protein IB) (PAP IB) (Regenerating islet-derived protein III-gamma) (REG III) (Reg III-gamma) [Cleaved into: Regenerating islet-derived protein 3-gamma 16.5 kDa form; Regenerating islet-derived protein 3-gamma 15 kDa form]	REG3G PAP1B UNQ429/PRO162	Homo sapiens (Human)	175
Q6YT39	unreviewed	Q6YT39_PIG	Lactotransferrin	LTF	Sus scrofa (Pig)	704
Q7DNA1	reviewed	CHI2_ORYSJ	Chitinase 2 (EC 3.2.1.14) (Class I chitinase b) (OsChia1b) (Pathogenesis related (PR)-3 chitinase 2)	Cht2 RC7 Os05g0399300 LOC_Os05g33130 OsJ_18467	Oryza sativa subsp. japonica (Rice)	340
Q7K4Z4	reviewed	IMD_DROME	Protein immune deficiency	imd CG5576	Drosophila melanogaster (Fruit fly)	273
Q7TNI7	reviewed	IL17F_MOUSE	Interleukin-17F (IL-17F)	Il17f	Mus musculus (Mouse)	161
Q834B6	reviewed	LIAX_ENTFA	Putative adhesin domain-containing protein LiaX (Daptomycin-sensing surface protein LiaX)	liaX EF_1753	Enterococcus faecalis (strain ATCC 700802 / V583)	533
Q86DA5	reviewed	SARM1_CAEEL	NAD(+) hydrolase tir-1 (NADase tir-1) (EC 3.2.2.6) (Neuronal symmetry protein 2) (SARM1 homolog) (Sterile alpha and TIR motif-containing protein tir-1)	tir-1 nsy-2 F13B10.1	Caenorhabditis elegans	981
Q86LE5	reviewed	MPSIN_RHIMP	Antimicrobial peptide microplusin (Microplusin)		Rhipicephalus microplus (Cattle tick) (Boophilus microplus)	110
Q8IQ27	reviewed	UBP2_DROME	Ubiquitin carboxyl-terminal hydrolase Usp2 (EC 3.4.19.12) (Ubiquitin specific protease 2)	Usp2 CG14619	Drosophila melanogaster (Fruit fly)	938
Q8K4C2	reviewed	I17RC_MOUSE	Interleukin-17 receptor C (IL-17 receptor C) (IL-17RC) (Interleukin-17 receptor-like protein) (IL-17RL) (ZcytoR14)	Il17rc	Mus musculus (Mouse)	698
Q8N4F0	reviewed	BPIB2_HUMAN	BPI fold-containing family B member 2 (Bactericidal/permeability-increasing protein-like 1) (BPI-like 1) (Long palate, lung and nasal epithelium carcinoma-associated protein 2) (RYSR)	BPIFB2 BPIL1 C20orf184 LPLUNC2 UNQ2489/PRO5776	Homo sapiens (Human)	458
Q8N8V2	reviewed	GBP7_HUMAN	Guanylate-binding protein 7 (EC 3.6.1.-) (EC 3.6.5.-) (GTP-binding protein 7) (GBP-7) (Guanine nucleotide-binding protein 7) (Guanylate-binding protein 4-like)	GBP7 GBP4L	Homo sapiens (Human)	638
Q8NAC3	reviewed	I17RC_HUMAN	Interleukin-17 receptor C (IL-17 receptor C) (IL-17RC) (Interleukin-17 receptor homolog) (IL17Rhom) (Interleukin-17 receptor-like protein) (IL-17RL) (ZcytoR14)	IL17RC UNQ6118/PRO20040/PRO38901	Homo sapiens (Human)	791
Q8SPP7	reviewed	PGRP1_BOVIN	Peptidoglycan recognition protein 1 (Oligosaccharide-binding protein) (OBP) (Peptidoglycan recognition protein short) (PGRP-S)	PGLYRP1 PGLYRP PGRP	Bos taurus (Bovine)	190
Q8SXQ7	reviewed	PGPLF_DROME	Peptidoglycan-recognition protein LF (PGRP-like protein)	PGRP-LF CG4437	Drosophila melanogaster (Fruit fly)	369
Q8TDL5	reviewed	BPIB1_HUMAN	BPI fold-containing family B member 1 (Long palate, lung and nasal epithelium carcinoma-associated protein 1) (von Ebner minor salivary gland protein) (VEMSGP)	BPIFB1 C20orf114 LPLUNC1 UNQ706/PRO1357	Homo sapiens (Human)	484
Q8VCS0	reviewed	PGRP2_MOUSE	N-acetylmuramoyl-L-alanine amidase (EC 3.5.1.28) (Peptidoglycan recognition protein 2) (Peptidoglycan recognition protein long) (PGRP-L) (TagL)	Pglyrp2 Pglyrpl Pgrpl	Mus musculus (Mouse)	530
Q8WWA0	reviewed	ITLN1_HUMAN	Intelectin-1 (ITLN-1) (Endothelial lectin HL-1) (Galactofuranose-binding lectin) (Intestinal lactoferrin receptor) (Omentin)	ITLN1 INTL ITLN LFR UNQ640/PRO1270	Homo sapiens (Human)	313
Q8ZNF3	reviewed	ARNB_SALTY	UDP-4-amino-4-deoxy-L-arabinose--oxoglutarate aminotransferase (EC 2.6.1.87) (Polymyxin resistance protein PmrH) (UDP-(beta-L-threo-pentapyranosyl-4''-ulose diphosphate) aminotransferase) (UDP-Ara4O aminotransferase) (UDP-4-amino-4-deoxy-L-arabinose aminotransferase)	arnB pbgP pbgP1 pmrH STM2297	Salmonella typhimurium (strain LT2 / SGSC1412 / ATCC 700720)	385
Q8ZR06	reviewed	PAGP_SALTY	Lipid A acyltransferase PagP (EC 2.3.1.251) (Antimicrobial peptide resistance) (Lipid A acylation protein)	pagP STM0628	Salmonella typhimurium (strain LT2 / SGSC1412 / ATCC 700720)	190
Q91WS2	reviewed	NLRP6_MOUSE	NACHT, LRR and PYD domains-containing protein 6 (Angiotensin II/vasopressin receptor) (Non-angiotensin-vasopressin receptor) (Non-AVR) (PYRIN-containing APAF1-like protein 5-like)	Nlrp6 Nalp6 Navr Pypaf5	Mus musculus (Mouse)	869
Q91Z40	reviewed	GBP7_MOUSE	Guanylate-binding protein 7 (EC 3.6.1.-) (EC 3.6.5.-) (GTP-binding protein 7) (GBP-7) (Guanine nucleotide-binding protein 7) (Guanylate-binding protein 4-like)	Gbp7 Gbp4l	Mus musculus (Mouse)	638
Q93091	reviewed	RNAS6_HUMAN	Ribonuclease K6 (RNase K6) (EC 3.1.27.-)	RNASE6 RNS6	Homo sapiens (Human)	150
Q96DR5	reviewed	BPIA2_HUMAN	BPI fold-containing family A member 2 (Parotid secretory protein) (PSP) (Short palate, lung and nasal epithelium carcinoma-associated protein 2)	BPIFA2 C20orf70 SPLUNC2 UNQ510/PRO1025	Homo sapiens (Human)	249
Q96F46	reviewed	I17RA_HUMAN	Interleukin-17 receptor A (IL-17 receptor A) (IL-17RA) (CDw217) (CD antigen CD217)	IL17RA IL17R	Homo sapiens (Human)	866
Q96LB8	reviewed	PGRP4_HUMAN	Peptidoglycan recognition protein 4 (Peptidoglycan recognition protein I-beta) (PGLYRPIbeta) (PGRP-I-beta) (Peptidoglycan recognition protein intermediate beta)	PGLYRP4 PGRPIB SBBI67	Homo sapiens (Human)	373
Q96LB9	reviewed	PGRP3_HUMAN	Peptidoglycan recognition protein 3 (Peptidoglycan recognition protein I-alpha) (PGLYRPIalpha) (PGRP-I-alpha) (Peptidoglycan recognition protein intermediate alpha)	PGLYRP3 PGRPIA	Homo sapiens (Human)	341
Q96PD4	reviewed	IL17F_HUMAN	Interleukin-17F (IL-17F) (Cytokine ML-1)	IL17F	Homo sapiens (Human)	163
Q96PD5	reviewed	PGRP2_HUMAN	N-acetylmuramoyl-L-alanine amidase (EC 3.5.1.28) (Peptidoglycan recognition protein 2) (Peptidoglycan recognition protein long) (PGRP-L)	PGLYRP2 PGLYRPL PGRPL UNQ3103/PRO10102	Homo sapiens (Human)	576
Q9D244	reviewed	RNAS6_MOUSE	Ribonuclease K6 (RNase K6) (EC 3.1.27.-)	Rnase6	Mus musculus (Mouse)	153
Q9FRV1	reviewed	CHIA_SECCE	Basic endochitinase A (EC 3.2.1.14) (Rye seed chitinase-a) (RSC-a)	rsca	Secale cereale (Rye)	321
Q9H1E1	reviewed	RNAS7_HUMAN	Ribonuclease 7 (RNase 7) (EC 3.1.27.-) (Skin-derived antimicrobial protein 2) (SAP-2)	RNASE7 UNQ2516/PRO6006	Homo sapiens (Human)	156
Q9JLN4	reviewed	PGRP1_RAT	Peptidoglycan recognition protein 1 (Peptidoglycan recognition protein short) (PGRP-S)	Pglyrp1 Pglyrp Pgrp	Rattus norvegicus (Rat)	183
Q9M2U5	reviewed	CHI5_ARATH	Endochitinase EP3 (EC 3.2.1.14) (Chitinase class IV) (AtchitIV) (Protein HOMOLOG OF CARROT EP3-3 CHITINASE) (AtEP3)	EP3 CHIV At3g54420 T12E18.110	Arabidopsis thaliana (Mouse-ear cress)	273
Q9NHB0	reviewed	GNBP1_DROME	Gram-negative bacteria-binding protein 1	GNBP1 CG6895	Drosophila melanogaster (Fruit fly)	494
Q9NP55	reviewed	BPIA1_HUMAN	BPI fold-containing family A member 1 (Lung-specific protein X) (Nasopharyngeal carcinoma-related protein) (Palate lung and nasal epithelium clone protein) (Secretory protein in upper respiratory tracts) (Short PLUNC1) (SPLUNC1) (Tracheal epithelium-enriched protein) (Von Ebner protein Hl)	BPIFA1 LUNX NASG PLUNC SPLUNC1 SPURT UNQ787/PRO1606	Homo sapiens (Human)	256
Q9NZH7	reviewed	IL36B_HUMAN	Interleukin-36 beta (FIL1 eta) (Interleukin-1 eta) (IL-1 eta) (Interleukin-1 family member 8) (IL-1F8) (Interleukin-1 homolog 2) (IL-1H2)	IL36B IL1F8 IL1H2	Homo sapiens (Human)	164
Q9QUK9	reviewed	TRY5_MOUSE	Trypsin-5 (EC 3.4.21.4) (Testicular-specific serine protease 4) (Trypsinogen 9) (T9)	Try5 Tc Tesp4	Mus musculus (Mouse)	246
Q9R0T7	reviewed	TRY4_MOUSE	Trypsin-4 (EC 3.4.21.4)	Try4 T8 Td	Mus musculus (Mouse)	246
Q9SPL3	reviewed	AMP23_MACIN	Vicilin-like antimicrobial peptides 2-3 (MiAMP2) (Vicilin-like protein Mac i 1) (allergen Mac i 1.0101) [Cleaved into: Antimicrobial peptide 2a (MiAMP2a); Antimicrobial peptide 2b (MiAMP2b); Antimicrobial peptide 2c-1 (MiAMP2c-1); Antimicrobial peptide 2c-2 (MiAMP2c-2); Antimicrobial peptide 2c-3 (MiAMP2c-3); Antimicrobial peptide 2d (MiAMP2d)]	AMP2-3	Macadamia integrifolia (Macadamia nut)	625
Q9V3Z2	reviewed	SER7_DROME	Serine protease 7 (EC 3.4.21.-) (Melanization protease 2)	Sp7 MP2 PAE1 CG3066	Drosophila melanogaster (Fruit fly)	391
Q9V477	reviewed	TOLL8_DROME	Toll-like receptor Tollo (Toll-like receptor 8)	Tollo Tl-8 Toll-8 CG6890	Drosophila melanogaster (Fruit fly)	1346
Q9VC56	reviewed	PUF_DROME	Ubiquitin carboxyl-terminal hydrolase puf (EC 3.4.19.12) (Protein puffyeye)	puf Usp34 CG5794	Drosophila melanogaster (Fruit fly)	3912
Q9VYX7	reviewed	PGPSA_DROME	Peptidoglycan-recognition protein SA (EC 3.4.17.13) (Protein semmelweis)	PGRP-SA seml CG11709	Drosophila melanogaster (Fruit fly)	203
A0A0F6B506	reviewed	SARA_SALT1	Salmonella anti-inflammatory response activator (SarA) (Salmonella translocated effector E)	sarA gogC pagJ steE stm2585 STM14_3166	Salmonella typhimurium (strain 14028s / SGSC 2262)	181
A0A144LVL3	reviewed	CTCN2_ECHES	Centrocin 2 (EeCentrocin 2) [Cleaved into: Centrocin 2, heavy chain; Centrocin 2, light chain]		Echinus esculentus (Sea urchin)	121
A0A1S6EK91	reviewed	MO1_MOROL	Morintide mO1 (8C-hevein-like protein)		Moringa oleifera (Horseradish tree) (Moringa pterygosperma)	79
A0A2I8B346	reviewed	AMP1_PARCM	Paralithocin 1 (P23)		Paralithodes camtschaticus (Red king crab) (Maja camtschatica)	62
A0A2I8B352	reviewed	AMP2_PARCM	Paralithocin 2 (P30)		Paralithodes camtschaticus (Red king crab) (Maja camtschatica)	71
A0A2I8B353	reviewed	AMP3_PARCM	Paralithocin 3 (P34)		Paralithodes camtschaticus (Red king crab) (Maja camtschatica)	76
A0AEI5	reviewed	BR2B_SYLGU	Brevinin-2GHb (AMP-2)	br2GHb	Sylvirana guentheri (Gunther's frog) (Rana guentheri)	72
A0AEI6	reviewed	BR2C_SYLGU	Brevinin-2GHc (AMP-4)	br2GHc	Sylvirana guentheri (Gunther's frog) (Rana guentheri)	72
A7XQ02	reviewed	MLX56_MORAL	Mulatexin (MLX56) (Latex protein)		Morus alba (White mulberry)	415
A8AUS0	reviewed	SSPA_STRGC	Streptococcal surface protein A (Adhesin SspS)	sspA SGO_0210	Streptococcus gordonii (strain Challis / ATCC 35105 / BCRC 15272 / CH1 / DL1 / V288)	1575
A8AUS1	reviewed	SSPB_STRGC	Streptococcal surface protein B (Adhesin SspB)	sspB SGO_0211	Streptococcus gordonii (strain Challis / ATCC 35105 / BCRC 15272 / CH1 / DL1 / V288)	1499
A8CZZ0	reviewed	SP151_IXORI	Salivary protein 15 Iric-1 (Salp15 Iric-1) (Probable ortholog of I.scapularis salivary protein 15) (Salp15-like)		Ixodes ricinus (Common tick) (Acarus ricinus)	134
A8DY01	reviewed	PLEA1_NIDPL	Pleurain-A1		Nidirana pleuraden (Yunnan pond frog) (Babina pleuraden)	69
B3A0M3	reviewed	BR2_ODOJI	Brevinin-2JD		Odorrana jingdongensis (Jingdong frog) (Rana jingdongensis)	33
B3A0M6	reviewed	NIG2A_ODOJI	Nigrocin-2JDa		Odorrana jingdongensis (Jingdong frog) (Rana jingdongensis)	21
B3A0M7	reviewed	NIG2B_ODOJI	Nigrocin-2JDb		Odorrana jingdongensis (Jingdong frog) (Rana jingdongensis)	21
B3KYH4	reviewed	TPA_PELSA	Temporin-SHa (Temporin-1Sa) (Temp-1Sa)		Pelophylax saharicus (Sahara frog) (Rana saharica)	50
B3KYH6	reviewed	TPC_PELSA	Temporin-SHc (Temporin-1Sc) (Temp-1Sc)		Pelophylax saharicus (Sahara frog) (Rana saharica)	50
B3VZU0	reviewed	BR1CA_RANDY	Brevinin-1CDYa		Rana dybowskii (Dybovsky's frog) (Korean brown frog)	67
B7XFU7	reviewed	SP151_IXOPE	Salivary protein 15 Iper-1 (IperSalp15-1) (Salp15 Iper-1) (Salp15-like)	Salp15	Ixodes persulcatus (Taiga tick)	135
B7XFU8	reviewed	SP152_IXOPE	Salivary protein 15 Iper-2 (IperSalp15-2) (Salp15 Iper-2) (Salp15-like)	Salp15	Ixodes persulcatus (Taiga tick)	132
C0H3X7	reviewed	MPRF_BACSU	Phosphatidylglycerol lysyltransferase (EC 2.3.2.3) (Lysylphosphatidylglycerol synthase) (LPG synthase)	mprF yfiW yfiX BSU08425 BSU08420 BSU08430	Bacillus subtilis (strain 168)	856
C0HK42	reviewed	LL1_LASLA	Lasioglossin-1 (LL-I)		Lasioglossum laticeps (Bee)	15
C0HK43	reviewed	LL2_LASLA	Lasioglossin-2 (LL-II)		Lasioglossum laticeps (Bee)	15
C0HL57	reviewed	NDB4C_ISOMC	Peptide Im-6		Isometrus maculatus (Lesser brown scorpion) (Scorpio maculatus)	16
C0HL59	reviewed	NDB4A_ISOMC	Peptide Im-4 (Im4)		Isometrus maculatus (Lesser brown scorpion) (Scorpio maculatus)	74
C0HL73	reviewed	NIG2B_ODOGR	Nigrocin-2GRb		Odorrana grahami (Yunnanfu frog) (Rana grahami)	21
C0HL85	reviewed	PNGK_PANCL	Panurgine K (PNG-K)		Panurgus calcaratus (Solitary bee)	25
C0HL86	reviewed	PNGR_PANCL	Panurgine R (PNG-R)		Panurgus calcaratus (Solitary bee)	25
C0HLN6	reviewed	TURB_SYNTU	Turgencin-B		Synoicum turgens (Colonial ascidian)	35
C3RT17	reviewed	GGN1_LIMKU	Gaegurin-LK1		Limnonectes kuhlii (Kuhl's Creek frog) (Rana kuhlii)	70
C3RT18	reviewed	GGN2_LIMKU	Gaegurin-LK2		Limnonectes kuhlii (Kuhl's Creek frog) (Rana kuhlii)	70
C3RT22	reviewed	TP1_LIMKU	Temporin-LK1		Limnonectes kuhlii (Kuhl's Creek frog) (Rana kuhlii)	65
C3RT23	reviewed	RUG1_LIMKU	Rugosin-LK1		Limnonectes kuhlii (Kuhl's Creek frog) (Rana kuhlii)	75
C3RT24	reviewed	RUG2_LIMKU	Rugosin-LK2		Limnonectes kuhlii (Kuhl's Creek frog) (Rana kuhlii)	75
C5H0D4	reviewed	E2ALA_AMOLO	Esculentin-2-ALa (Amolopin-9a)		Amolops loloensis (Lolokou Sucker Frog) (Staurois loloensis)	76
C5H0D5	reviewed	E2ALB_AMOLO	Esculentin-2-ALb (Amolopin-9b)		Amolops loloensis (Lolokou Sucker Frog) (Staurois loloensis)	76
C5H0D6	reviewed	TPD_AMOLO	Temporin-ALd (Amolopin-2e)		Amolops loloensis (Lolokou Sucker Frog) (Staurois loloensis)	64
C5H0D7	reviewed	TPE_AMOLO	Temporin-ALe (Amolopin-2f)		Amolops loloensis (Lolokou Sucker Frog) (Staurois loloensis)	64
C5H0D8	reviewed	TPF_AMOLO	Temporin-ALf (Amolopin-2g)		Amolops loloensis (Lolokou Sucker Frog) (Staurois loloensis)	64
C7B247	reviewed	NDB47_ISOMC	Imcroporin (Non-disulfide-bridged peptide 4.7) (NDBP-4.7)		Isometrus maculatus (Lesser brown scorpion) (Scorpio maculatus)	74
E1UYT9	reviewed	AMP1_STEME	Antimicrobial peptide 1 (SmAMP1) [Cleaved into: Antimicrobial peptide 1.1a (SmAMP1.1a) (SmMP1.1a); Antimicrobial peptide 1.2a (Sm-AMP-1.2a)]		Stellaria media (Common chickweed) (Alsine media)	167
E1WFA0	reviewed	PHOQ_SALTS	Virulence sensor histidine kinase PhoQ (EC 2.7.13.3) (EC 3.1.3.-) (Sensor histidine protein kinase/phosphatase PhoQ)	phoQ SL1344_1168	Salmonella typhimurium (strain SL1344)	487
E7EKC4	reviewed	BR11_ODOHA	Brevinin-1HN1		Odorrana hainanensis (Odor frog) (Rana hainanensis)	71
E7EKD0	reviewed	TP1_ODOHA	Temporin-HN1		Odorrana hainanensis (Odor frog) (Rana hainanensis)	62
E7EKD4	reviewed	TP2_ODOHA	Temporin-HN2		Odorrana hainanensis (Odor frog) (Rana hainanensis)	59
F1T149	reviewed	ES1IA_ODOIS	Esculentin-1SIa		Odorrana ishikawae (Ishikawa's frog) (Rana ishikawae)	84
F1T150	reviewed	ES1IB_ODOIS	Esculentin-1ISb		Odorrana ishikawae (Ishikawa's frog) (Rana ishikawae)	84
F1T151	reviewed	ES2IA_ODOIS	Esculentin-2ISa		Odorrana ishikawae (Ishikawa's frog) (Rana ishikawae)	78
F1T152	reviewed	PA2IA_ODOIS	Palustrin-2ISa		Odorrana ishikawae (Ishikawa's frog) (Rana ishikawae)	70
F1T156	reviewed	NIG2A_ODOIS	Nigrocin-2ISa		Odorrana ishikawae (Ishikawa's frog) (Rana ishikawae)	66
F1T157	reviewed	NIG2B_ODOIS	Nigrocin-2ISb		Odorrana ishikawae (Ishikawa's frog) (Rana ishikawae)	66
F2Z472	reviewed	SVS3A_MOUSE	Seminal vesicle secretory protein 3A (Seminal vesicle secretory protein III) (SVS III)	Svs3a Svs3	Mus musculus (Mouse)	265
G3ETQ2	reviewed	JNG1A_AMOJI	Jindongenin-1a (Jindongenin-1)		Amolops jingdongensis (Chinese torrent frog)	66
G3ETQ3	reviewed	P2AJ1_AMOJI	Palustrin-2AJ1		Amolops jingdongensis (Chinese torrent frog)	71
G3MWP1	unreviewed	G3MWP1_BOVIN	Elastase, neutrophil expressed	ELANE	Bos taurus (Bovine)	284
L0GCI6	reviewed	NDB4H_UROYA	Antimicrobial peptide UyCT3 (CT3) (Non-disulfide-bridged peptide 4.17) (NDBP-4.17) (Non-disulfide-bridged peptide 5.15) (NDBP-5.15)		Urodacus yaschenkoi (Inland robust scorpion)	68
L0P329	reviewed	MDS_AGACL	Medusin-C1 (MDS-C1) (Medusin-AC) (Phyllin-AC)		Agalychnis callidryas (Red-eyed tree frog) (Phyllomedusa callidryas)	68
L0P3K3	reviewed	MDS_AGADC	Medusin-DA1 (MDS-DA1) (Medusin-PD) (Phyllin-PD)		Agalychnis dacnicolor (Giant Mexican leaf frog) (Pachymedusa dacnicolor)	68
L0P402	reviewed	MDS_PITHY	Medusin-H1 (MDS-H1) (Medusin-PH) (Phyllin-PH)		Pithecopus hypochondrialis (Orange-legged leaf frog) (Phyllomedusa hypochondrialis)	67
O16262	reviewed	NIPI4_CAEEL	Protein nipi-4 (No induction of peptide after drechmeria infection protein 4)	nipi-4 F40A3.5	Caenorhabditis elegans	396
O24866	reviewed	LPXE_HELPY	Lipid A 1-phosphatase (EC 3.1.-.-)	lpxE HP_0021 C694_00100	Helicobacter pylori (strain ATCC 700392 / 26695) (Campylobacter pylori)	190
O52324	reviewed	ARNC_SALTY	Undecaprenyl-phosphate 4-deoxy-4-formamido-L-arabinose transferase (EC 2.4.2.53) (Polymyxin resistance protein PmrF) (Undecaprenyl-phosphate Ara4FN transferase) (Ara4FN transferase)	arnC pbgP2 pmrF STM2298	Salmonella typhimurium (strain LT2 / SGSC1412 / ATCC 700720)	327
O52327	reviewed	ARNT_SALTY	Undecaprenyl phosphate-alpha-4-amino-4-deoxy-L-arabinose arabinosyl transferase (EC 2.4.2.43) (4-amino-4-deoxy-L-arabinose lipid A transferase) (Lipid IV(A) 4-amino-4-deoxy-L-arabinosyltransferase) (Polymyxin resistance protein PmrK) (Undecaprenyl phosphate-alpha-L-Ara4N transferase)	arnT pmrK STM2301	Salmonella typhimurium (strain LT2 / SGSC1412 / ATCC 700720)	547
O93454	reviewed	PTC1_AGADC	Plasticin-DA1 (PTC-DA1) (Dermaseptin PD-3-6) (DRP-PD3-6) (PD36)		Agalychnis dacnicolor (Giant Mexican leaf frog) (Pachymedusa dacnicolor)	71
P01376	reviewed	DEF3_RABIT	Corticostatin-3 (Antiadrenocorticotropin peptide III) (Corticostatin III) (CS-III) (Macrophage antibiotic peptide MCP-1) (NP-1)		Oryctolagus cuniculus (Rabbit)	95
P01377	reviewed	DEF4_RABIT	Defensin alpha 4 (Antiadrenocorticotropin peptide IV) (Corticostatin IV) (CS-IV) (Corticostatin-4) (Macrophage antibiotic peptide MCP-2) (NP-2)		Oryctolagus cuniculus (Rabbit)	95
P02858	reviewed	GLYG4_SOYBN	Glycinin G4 (Glycinin 11S G4) (Glycinin A5A4B3) (allergen Gly m 6) [Cleaved into: Glycinin A5 subunit; Glycinin A4 subunit; Glycinin B3 subunit]	GY4 Glyma10g04280	Glycine max (Soybean) (Glycine hispida)	563
P02876	reviewed	AGI2_WHEAT	Agglutinin isolectin 2 (Isolectin D) (WGA2)		Triticum aestivum (Wheat)	213
P02877	reviewed	HEVE_HEVBR	Pro-hevein (Major hevein) [Cleaved into: Hevein; Win-like protein]	HEV1	Hevea brasiliensis (Para rubber tree) (Siphonia brasiliensis)	204
P06215	reviewed	CHIT_PHAVU	Endochitinase (EC 3.2.1.14)		Phaseolus vulgaris (Kidney bean) (French bean)	328
P07198	reviewed	XENO_XENLA	Xenopsin peptides [Cleaved into: Xenopsin precursor fragment (XPF); Xenopsin]		Xenopus laevis (African clawed frog)	81
P07469	reviewed	DEF1_RABIT	Corticostatin 1 (Antiadrenocorticotropin peptide I) (Corticostatin I) (CS-I) (Microbicidal peptide NP-3A) (Neutrophil antibiotic peptide NP-3A)		Oryctolagus cuniculus (Rabbit)	93
P09805	reviewed	KTXA_KLULA	Killer toxin subunits alpha/beta (RF2 protein) [Cleaved into: Killer toxin subunit alpha; Killer toxin subunit beta (EC 3.2.1.14) (Endochitinase)]		Kluyveromyces lactis (strain ATCC 8585 / CBS 2359 / DSM 70799 / NBRC 1267 / NRRL Y-1140 / WM37) (Yeast) (Candida sphaerica)	1146
P0AAH8	reviewed	SAPF_ECOLI	Putrescine export system ATP-binding protein SapF	sapF b1290 JW1283	Escherichia coli (strain K12)	268
P0AGH3	reviewed	SAPB_ECOLI	Putrescine export system permease protein SapB	sapB b1293 JW1286	Escherichia coli (strain K12)	321
P0AGH5	reviewed	SAPC_ECOLI	Putrescine export system permease protein SapC	sapC b1292 JW1285	Escherichia coli (strain K12)	296
P0C5W7	reviewed	BR1B_RANDY	Brevinin-1DYb (Brevinin-1CDYb)		Rana dybowskii (Dybovsky's frog) (Korean brown frog)	66
P0CJ32	reviewed	ASCA8_ASCTR	Ascaphin-8		Ascaphus truei (Coastal tailed frog)	19
P0DM78	reviewed	PHOP_SALTY	Virulence transcriptional regulatory protein PhoP (Acid shock protein 29) (ASP29)	phoP STM1231	Salmonella typhimurium (strain LT2 / SGSC1412 / ATCC 700720)	224
P0DQX4	reviewed	HAL1_HALST	Halictine-1 (HAL-1) (Halictin 1) (Halictine I)		Halictus sexcinctus (Six-banded furrow bee) (Apis sexcincta)	12
P0DQX5	reviewed	HAL2_HALST	Halictine-2 (HAL-2) (Halictin 2) (Halictine II)		Halictus sexcinctus (Six-banded furrow bee) (Apis sexcincta)	12
P0DQZ4	reviewed	MAST1_VESTR	Mastoparan-VT1 [Cleaved into: Mastoparan-VT2]		Vespa tropica (Greater banded hornet) (Sphex tropica)	60
P0DRA0	reviewed	VCP1_VESTR	Vespid chemotactic peptide VT1 (VCP-VT1) [Cleaved into: Vespid chemotactic peptide VT2 (VCP-VT2)]		Vespa tropica (Greater banded hornet) (Sphex tropica)	65
P0DRA1	reviewed	MAST1_VESBI	Mastoparan-VB1 (MP-VB1)		Vespa bicolor (Black shield wasp)	60
P0DRA3	reviewed	VESP1_VESBI	VESP-VB1		Vespa bicolor (Black shield wasp)	65
P0DTW2	reviewed	AS48L_BACIA	Pumilarin (Circular bacteriocin) (Enterocin AS-48-like) (Head-to-tail cyclized peptide)	B4107_2383	Bacillus safensis	108
P10968	reviewed	AGI1_WHEAT	Agglutinin isolectin 1 (Isolectin A) (WGA1)		Triticum aestivum (Wheat)	212
P10969	reviewed	AGI3_WHEAT	Agglutinin isolectin 3 (WGA3)		Triticum aestivum (Wheat)	186
P11006	reviewed	MAGA_XENLA	Magainins [Cleaved into: Small acidic peptide 1; Small acidic peptide 2; Small acidic peptide 3; Magainin-1 (Magainin I); Magainin-2 (Magainin II)]	magainins	Xenopus laevis (African clawed frog)	303
P11828	reviewed	GLYG3_SOYBN	Glycinin G3 (Glycinin 11S G3) (Glycinin A1bB2) (allergen Gly m 6) [Cleaved into: Glycinin A1b subunit (Glycinin A subunit); Glycinin B2 subunit (Glycinin B subunit)]	GY3 Glyma19g34780	Glycine max (Soybean) (Glycine hispida)	481
P12069	reviewed	LYSC3_PIG	Lysozyme C-3 (EC 3.2.1.17) (1,4-beta-N-acetylmuramidase C)		Sus scrofa (Pig)	148
P21226	reviewed	CHI2_PEA	Endochitinase A2 (EC 3.2.1.14)	CHI2	Pisum sativum (Garden pea) (Lathyrus oleraceus)	324
P23132	reviewed	LITH_BOVIN	Lithostathine (Islet cells regeneration factor) (ICRF) (Islet of Langerhans regenerating protein) (REG) (Pancreatic stone protein) (PSP) (Pancreatic thread protein) (PTP) [Cleaved into: Lithostathine A chain; Lithostathine B chain]	PTP	Bos taurus (Bovine)	175
P24302	reviewed	DRS1_PHYSA	Dermaseptin-S1 (DRS-S1) (Dermaseptin) (DS) (Dermaseptin I) (DS I) (Dermaseptin-1) (DS1)		Phyllomedusa sauvagei (Sauvage's leaf frog)	79
P25403	reviewed	AMP1_MIRJA	Antimicrobial peptide 1 (MJ-AMP1) (AMP1)	AMP1	Mirabilis jalapa (Garden four-o'clock)	61
P29023	reviewed	CHIB_MAIZE	Endochitinase B (EC 3.2.1.14) (ChitB) (Seed chitinase B)	CHIB CTB1	Zea mays (Maize)	281
P32194	reviewed	PG1_PIG	Protegrin-1 (PG-1) (Neutrophil peptide 1)	NPG1	Sus scrofa (Pig)	149
P32196	reviewed	PG3_PIG	Protegrin-3 (PG-3)	NPG3	Sus scrofa (Pig)	149
P32412	reviewed	BR1_PELLE	Brevinin-1E		Pelophylax lessonae (Pool frog) (Rana lessonae)	71
P33046	reviewed	CTHL4_BOVIN	Cathelicidin-4 (Indolicidin)	CATHL4	Bos taurus (Bovine)	144
