Entry	Reviewed	Entry Name	Protein names	Gene Names	Organism	Length
A0A0A1I6E7	reviewed	NDB4S_ANDCR	Antimicrobial peptide AcrAP1		Androctonus crassicauda (Arabian fat-tailed scorpion)	74
A0A0A1I6N9	reviewed	NDB4T_ANDCR	Antimicrobial peptide AcrAP2		Androctonus crassicauda (Arabian fat-tailed scorpion)	74
A0A126GUP6	reviewed	MP1_DROME	Melanization protease 1 (EC 3.4.21.-)	MP1 CG1102	Drosophila melanogaster (Fruit fly)	400
A0A144LUY5	reviewed	CTCN1_ECHES	Centrocin 1 (EeCentrocin 1) [Cleaved into: Centrocin 1, heavy chain; Centrocin 1, light chain]		Echinus esculentus (Sea urchin)	119
A0A1L3THR9	reviewed	CDA_PESTX	Chitin deacetylase (EC 3.5.1.41)	CDA	Pestalotiopsis sp	298
A5HAK0	reviewed	RNSL3_DANRE	Ribonuclease-like 3 (RNase ZF-3) (RNase-like 3) (ZF-RNase-3) (EC 3.1.27.-) (Dr-RNase 1) [Cleaved into: N-terminal peptide; LF-ZF3]	rnasel3	Danio rerio (Zebrafish) (Brachydanio rerio)	149
B3EWR6	reviewed	AMP_ECHCG	Antimicrobial peptides [Cleaved into: Antimicrobial peptide 1 (EcAMP1); Antimicrobial peptide 3 (EcAMP3); Antimicrobial peptide 2 (EcAMP2); Antimicrobial peptide 2.1 (EcAMP2.1)]		Echinochloa crus-galli (Barnyard grass) (Panicum crus-galli)	361
B8AL97	reviewed	CUCIN_ORYSI	Cupincin (EC 3.4.-.-) (52 kDa globulin-like protein) (allergen Ory s NRA)	OsI_13867	Oryza sativa subsp. indica (Rice)	470
C0HJQ3	reviewed	H2A_ACIGU	Histone H2A [Cleaved into: Acipensin 1 (Ac1); Acipensin 2 (Ac2); Acipensin 3 (Ac3); Acipensin 4 (Ac4); Acipensin 5 (Ac5); Acipensin 6 (Ac6)]		Acipenser gueldenstaedtii (Russian sturgeon) (Danube sturgeon)	76
C0HK44	reviewed	LL3_LASLA	Lasioglossin-3 (LL-III)		Lasioglossum laticeps (Bee)	15
C0HL58	reviewed	NDB4B_ISOMC	Peptide Im-5 (Im5)		Isometrus maculatus (Lesser brown scorpion) (Scorpio maculatus)	79
C0HL84	reviewed	PNG1_PANCL	Panurgin 1 (PNG-1)		Panurgus calcaratus (Solitary bee)	12
D0ZV89	reviewed	PHOQ_SALT1	Virulence sensor histidine kinase PhoQ (EC 2.7.13.3) (EC 3.1.3.-) (Sensor histidine protein kinase/phosphatase PhoQ)	phoQ STM14_1408	Salmonella typhimurium (strain 14028s / SGSC 2262)	487
G5EED4	reviewed	NIPI3_CAEEL	Protein nipi-3 (No induction of peptide after drechmeria infection protein 3) (Tribbles homolog nipi-3)	nipi-3 K09A9.1	Caenorhabditis elegans	655
I0DEB3	reviewed	NDB4D_VAEMS	Amphipathic peptide VmCT1 (CT1) (Non-disulfide-bridged peptide 4.13) (NDBP-4.13) (Non-disulfide-bridged peptide 5.13) (NDBP-5.13)		Vaejovis mexicanus smithi (Mexican scorpion) (Vaejovis smithi)	68
O09037	reviewed	REG3A_MOUSE	Regenerating islet-derived protein 3-alpha (REG-3-alpha) (Islet of Langerhans regenerating protein 3) (Lithostathine 3) (Pancreatitis-associated protein 2) (Regenerating islet-derived protein III-alpha) (Reg III-alpha) [Cleaved into: Regenerating islet-derived protein 3-alpha 16.5 kDa form; Regenerating islet-derived protein 3-alpha 15 kDa form]	Reg3a Pap2	Mus musculus (Mouse)	175
O09049	reviewed	REG3G_MOUSE	Regenerating islet-derived protein 3-gamma (REG-3-gamma) (Pancreatitis-associated protein 3) (Regenerating islet-derived protein III-gamma) (Reg III-gamma) [Cleaved into: Regenerating islet-derived protein 3-gamma 16.5 kDa form; Regenerating islet-derived protein 3-gamma 15 kDa form]	Reg3g Pap3	Mus musculus (Mouse)	174
O18330	reviewed	MRJP1_APIME	Major royal jelly protein 1 (56-kDa protein 4) (p56kP-4) (Apalbumin 1) (Apisin subunit MRJP1) (Bee-milk protein) (Royal jelly protein RJP57-3) (RJP-3) (Royalactin) [Cleaved into: Jellein-1 (Jelleine-I); Jellein-2 (Jelleine-II); Jellein-4 (Jelleine-IV)]	Mrjp1 GB14888	Apis mellifera (Honeybee)	432
O24006	reviewed	AMP_IMPBA	Antimicrobial peptides (IB-AMP) [Cleaved into: Basic peptide AMP3 (IB-AMP3); Basic peptide AMP1-1 (IB-AMP1-1); Basic peptide AMP1-2 (IB-AMP1-2); Basic peptide AMP1-3 (IB-AMP1-3); Basic peptide AMP2 (IB-AMP2); Basic peptide AMP4 (IB-AMP4)]	AMP	Impatiens balsamina (Balsam)	333
O44997	reviewed	DAPK_CAEEL	Death-associated protein kinase dapk-1 (EC 2.7.11.1)	dapk-1 mor-3 tag-119 K12C11.4	Caenorhabditis elegans	1425
O45813	reviewed	SNF12_CAEEL	Sodium-dependent transporter snf-12 (Sodium: neurotransmitter symporter family protein snf-12)	snf-12 nipi-2 T25B6.7	Caenorhabditis elegans	1022
O52325	reviewed	ARNA_SALTY	Bifunctional polymyxin resistance protein ArnA [Includes: UDP-4-amino-4-deoxy-L-arabinose formyltransferase (EC 2.1.2.13) (ArnAFT) (UDP-L-Ara4N formyltransferase); UDP-glucuronic acid oxidase, UDP-4-keto-hexauronic acid decarboxylating (EC 1.1.1.305) (ArnADH) (UDP-GlcUA decarboxylase) (UDP-glucuronic acid dehydrogenase)]	arnA pbgP3 pmrI STM2299	Salmonella typhimurium (strain LT2 / SGSC1412 / ATCC 700720)	660
O60814	reviewed	H2B1K_HUMAN	Histone H2B type 1-K (H2B K) (HIRA-interacting protein 1)	H2BC12 H2BFT HIRIP1 HIST1H2BK	Homo sapiens (Human)	126
O75594	reviewed	PGRP1_HUMAN	Peptidoglycan recognition protein 1 (Peptidoglycan recognition protein short) (PGRP-S)	PGLYRP1 PGLYRP PGRP TNFSF3L SBBI68 UNQ639/PRO1269	Homo sapiens (Human)	196
O88310	reviewed	ITL1A_MOUSE	Intelectin-1a (Galactofuranose-binding lectin) (Intestinal lactoferrin receptor)	Itln1 Intl Itln Itln1a Itlna	Mus musculus (Mouse)	313
O88593	reviewed	PGRP1_MOUSE	Peptidoglycan recognition protein 1 (Cytokine tag7) (Peptidoglycan recognition protein short) (PGRP-S)	Pglyrp1 Pglyrp Pgrp Pgrps Tag7	Mus musculus (Mouse)	182
O95925	reviewed	EPPI_HUMAN	Eppin (Cancer/testis antigen 71) (CT71) (Epididymal protease inhibitor) (Protease inhibitor WAP7) (Serine protease inhibitor-like with Kunitz and WAP domains 1) (WAP four-disulfide core domain protein 7)	EPPIN SPINLW1 WAP7 WFDC7	Homo sapiens (Human)	133
P00697	reviewed	LYSC1_RAT	Lysozyme C-1 (EC 3.2.1.17) (1,4-beta-N-acetylmuramidase C)	Lyz1 Lyz	Rattus norvegicus (Rat)	148
P00698	reviewed	LYSC_CHICK	Lysozyme C (EC 3.2.1.17) (1,4-beta-N-acetylmuramidase C) (Allergen Gal d IV) (allergen Gal d 4)	LYZ	Gallus gallus (Chicken)	147
P00762	reviewed	TRY1_RAT	Serine protease 1 (EC 3.4.21.4) (Anionic trypsin I) (Anionic trypsin-1) (Beta-trypsin) (Cationic trypsinogen) (Pretrypsinogen I) (Trypsin I) (Trypsin-1)	Prss1 Trp1 Try1 Tryp1	Rattus norvegicus (Rat)	246
P00763	reviewed	TRY2_RAT	Anionic trypsin-2 (EC 3.4.21.4) (Anionic trypsin II) (Pretrypsinogen II) (Serine protease 2)	Prss2 Try2	Rattus norvegicus (Rat)	246
P02788	reviewed	TRFL_HUMAN	Lactotransferrin (Lactoferrin) (EC 3.4.21.-) (Growth-inhibiting protein 12) (Talalactoferrin) [Cleaved into: Lactoferricin-H (Lfcin-H); Kaliocin-1; Lactoferroxin-A; Lactoferroxin-B; Lactoferroxin-C]	LTF GIG12 LF	Homo sapiens (Human)	710
P04279	reviewed	SEMG1_HUMAN	Semenogelin-1 (Cancer/testis antigen 103) (Semenogelin I) (SGI) [Cleaved into: Alpha-inhibin-92; Alpha-inhibin-31; Seminal basic protein]	SEMG1 SEMG	Homo sapiens (Human)	462
P04347	reviewed	GLYG5_SOYBN	Glycinin G5 (Glycinin 11S G5) (Glycinin A3B4) (allergen Gly m 6) [Cleaved into: Glycinin A3 subunit; Glycinin B4 subunit]	GY5 Glyma13g18450	Glycine max (Soybean) (Glycine hispida)	516
P04405	reviewed	GLYG2_SOYBN	Glycinin G2 (Glycinin 11S G2) (Glycinin A2B1a) (allergen Gly m 6) [Cleaved into: Glycinin A2 subunit; Glycinin B1a subunit]	GY2 Glyma03g32020	Glycine max (Soybean) (Glycine hispida)	485
P04776	reviewed	GLYG1_SOYBN	Glycinin G1 (Glycinin 11S G1) (Glycinin A1aB1b) (allergen Gly m 6) [Cleaved into: Glycinin A1a subunit (Glycinin acidic 1a subunit); Glycinin Bx subunit (Glycinin basic x subunit) (Glycinin B1b subunit) (Glycinin basic 1b subunit)]	GY1 Glyma03g32030	Glycine max (Soybean) (Glycine hispida)	495
P05371	reviewed	CLUS_RAT	Clusterin (Dimeric acid glycoprotein) (DAG) (Sulfated glycoprotein 2) (SGP-2) (Testosterone repressed prostate message 2) (TRPM-2) [Cleaved into: Clusterin beta chain; Clusterin alpha chain]	Clu	Rattus norvegicus (Rat)	447
P06899	reviewed	H2B1J_HUMAN	Histone H2B type 1-J (Histone H2B.1) (Histone H2B.r) (H2B/r)	H2BC11 H2BFR HIST1H2BJ	Homo sapiens (Human)	126
P07146	reviewed	TRY2_MOUSE	Anionic trypsin-2 (EC 3.4.21.4) (Anionic trypsin II) (Pretrypsinogen II) (Serine protease 2)	Prss2 Try2	Mus musculus (Mouse)	246
P07478	reviewed	TRY2_HUMAN	Trypsin-2 (EC 3.4.21.4) (Anionic trypsinogen) (Serine protease 2) (Trypsin II)	PRSS2 TRY2 TRYP2	Homo sapiens (Human)	247
P08071	reviewed	TRFL_MOUSE	Lactotransferrin (Lactoferrin) (EC 3.4.21.-)	Ltf	Mus musculus (Mouse)	707
P08246	reviewed	ELNE_HUMAN	Neutrophil elastase (EC 3.4.21.37) (Bone marrow serine protease) (Elastase-2) (Human leukocyte elastase) (HLE) (Medullasin) (PMN elastase)	ELANE ELA2	Homo sapiens (Human)	267
P08252	reviewed	CHI1_TOBAC	Endochitinase A (CHN-A) (EC 3.2.1.14)	CHN48	Nicotiana tabacum (Common tobacco)	329
P08311	reviewed	CATG_HUMAN	Cathepsin G (CG) (EC 3.4.21.20) [Cleaved into: Cathepsin G, C-terminal truncated form]	CTSG	Homo sapiens (Human)	255
P08904	reviewed	RNAS6_BOVIN	Ribonuclease K6 (RNase K6) (EC 3.1.27.-) (K6b) (Ribonuclease K2) (RNase K2)	RNASE6 RK6B RNS6	Bos taurus (Bovine)	154
P08905	reviewed	LYZ2_MOUSE	Lysozyme C-2 (EC 3.2.1.17) (1,4-beta-N-acetylmuramidase C) (Lysozyme C type M)	Lyz2 Lyz Lyzs	Mus musculus (Mouse)	148
P0AAH4	reviewed	SAPD_ECOLI	Putrescine export system ATP-binding protein SapD	sapD trkE b1291 JW1284	Escherichia coli (strain K12)	330
P0AD49	reviewed	YFIA_ECOLI	Ribosome-associated inhibitor A (Protein Y) (pY) (Ribosome associated factor Y) (Spot Y)	raiA yfiA b2597 JW2578	Escherichia coli (strain K12)	113
P0AFY6	reviewed	SBMA_ECOLI	Peptide antibiotic transporter SbmA	sbmA b0377 JW0368	Escherichia coli (strain K12)	406
P0C005	reviewed	ANOP_ANOSM	Anoplin (ANP) (As-183)		Anoplius samariensis (Solitary wasp)	10
P0DM80	reviewed	PHOQ_SALTY	Virulence sensor histidine kinase PhoQ (EC 2.7.13.3) (EC 3.1.3.-) (Sensor histidine protein kinase/phosphatase PhoQ)	phoQ phoZ STM1230	Salmonella typhimurium (strain LT2 / SGSC1412 / ATCC 700720)	487
P10354	reviewed	CMGA_RAT	Chromogranin-A (CgA) [Cleaved into: Pancreastatin; Beta-granin; WE-14; Catestatin; GE-25; Serpinin-RRG; Serpinin; p-Glu serpinin precursor]	Chga	Rattus norvegicus (Rat)	466
P10645	reviewed	CMGA_HUMAN	Chromogranin-A (CgA) (Pituitary secretory protein I) (SP-I) [Cleaved into: Vasostatin-1 (Vasostatin I); Vasostatin-2 (Vasostatin II); EA-92; ES-43; Pancreastatin; SS-18; WA-8; WE-14; LF-19; Catestatin (SL21); AL-11; GV-19; GR-44; ER-37; GE-25; Serpinin-RRG; Serpinin; p-Glu serpinin precursor]	CHGA	Homo sapiens (Human)	457
P10909	reviewed	CLUS_HUMAN	Clusterin (Aging-associated gene 4 protein) (Apolipoprotein J) (Apo-J) (Complement cytolysis inhibitor) (CLI) (Complement-associated protein SP-40,40) (Ku70-binding protein 1) (NA1/NA2) (Sulfated glycoprotein 2) (SGP-2) (Testosterone-repressed prostate message 2) (TRPM-2) [Cleaved into: Clusterin beta chain (ApoJalpha) (Complement cytolysis inhibitor a chain) (SP-40,40 beta-chain); Clusterin alpha chain (ApoJbeta) (Complement cytolysis inhibitor b chain) (SP-40,40 alpha-chain)]	CLU APOJ CLI KUB1 AAG4	Homo sapiens (Human)	449
P11218	reviewed	AGI_URTDI	Lectin/endochitinase 1 (EC 3.2.1.14) (Agglutinin) (UDA) (chia5.1.1) [Cleaved into: Lectin 1]	UDA1	Urtica dioica (Great nettle) (Stinging nettle)	372
P12724	reviewed	ECP_HUMAN	Eosinophil cationic protein (ECP) (EC 3.1.27.-) (Ribonuclease 3) (RNase 3)	RNASE3 ECP RNS3	Homo sapiens (Human)	160
P13487	reviewed	KAX11_LEIHE	Potassium channel toxin alpha-KTx 1.1 (ChTX-Lq1) (ChTx-a) (Charybdotoxin) (CTX) (ChTX)		Leiurus hebraeus (Hebrew deathstalker scorpion) (Leiurus quinquestriatus hebraeus)	59
P14423	reviewed	PA2GA_RAT	Phospholipase A2, membrane associated (EC 3.1.1.4) (GIIC sPLA2) (Group IIA phospholipase A2) (Phosphatidylcholine 2-acylhydrolase 2A)	Pla2g2a	Rattus norvegicus (Rat)	146
P14555	reviewed	PA2GA_HUMAN	Phospholipase A2, membrane associated (EC 3.1.1.4) (GIIC sPLA2) (Group IIA phospholipase A2) (Non-pancreatic secretory phospholipase A2) (NPS-PLA2) (Phosphatidylcholine 2-acylhydrolase 2A)	PLA2G2A PLA2B PLA2L RASF-A	Homo sapiens (Human)	144
P15515	reviewed	HIS1_HUMAN	Histatin-1 (Hst1) (Histidine-rich protein 1) (Post-PB protein) (PPB) [Cleaved into: His1-(31-57)-peptide (His1 31/57) (His1-(12-38)-peptide) (His1 12/38) (Histatin 2) (Hst2) (Histatin-2)]	HTN1 HIS1	Homo sapiens (Human)	57
P15516	reviewed	HIS3_HUMAN	Histatin-3 (Basic histidine-rich protein) (Hst) (Histatin 3) (Hst 3) (Histidine-rich protein 3) (PB) [Cleaved into: Histatin-3; His3-(20-44)-peptide (His3 20/44) (His3-(1-25)-peptide) (His3 1/25) (Histatin 6) (Histatin-3 1/25) (Histatin-6); His3-(20-43)-peptide (His3 20/43) (His3-(1-24)-peptide) (His3 1/24) (Histatin 5) (Hst 5) (Histatin-3 1/24) (Histatin-5); His3-(20-32)-peptide (His3 20/32) (His3-(1-13)-peptide) (His3 1/13) (Histatin-3 1/13); His3-(20-31)-peptide (His3 20/31) (His3-(1-12)-peptide) (His3 1/12) (Histatin-3 1/12); His3-(20-30)-peptide (His3 20/30) (His3-(1-11)-peptide) (His3 1/11) (Histatin-3 1/11); His3-(24-32)-peptide (His3 24/32) (His3-(5-13)-peptide) (His3 5/13) (Histatin-3 5/13); His3-(24-31)-peptide (His3 24/31) (His3-(5-12)-peptide) (His3 5/12) (Histatin 11) (Histatin-11) (Histatin-3 5/12); His3-(24-30)-peptide (His3 24/30) (His3-(5-11)-peptide) (His3 5/11) (Histatin 12) (Histatin-12) (Histatin-3 5/11); His3-(25-32)-peptide (His3 25/32) (His3-(6-13)-peptide) (His3 6/13) (Histatin-3 6/13); His3-(25-30)-peptide (His3 25/30) (His3-(6-11)-peptide) (His3 6/11) (Histatin-3 6/11); His3-(26-32)-peptide (His3 26/32) (His3-(7-13)-peptide) (His3 7/13) (Histatin-3 7/13); His3-(26-31)-peptide (His3 26/31) (His3-(7-12)-peptide) (His3 7/12) (Histatin-3 7/12); His3-(26-30)-peptide (His3 26/30) (His3-(7-11)-peptide) (His3 7/11) (Histatin-3 7/11); His3-(31-51)-peptide (His3 31/51) (His3-(12-32)-peptide) (His3 12/32) (Histatin 4) (Histatin-3 12/32) (Histatin-4); His3-(31-44)-peptide (His3 31/44) (His3-(12-25)-peptide) (His3 12/25) (Histatin 9) (Histatin-3 12/25) (Histatin-9); His3-(31-43)-peptide (His3 31/43) (His3-(12-24)-peptide) (His3 12/24) (Histatin 7) (Histatin-3 12/24) (Histatin-7); His3-(32-44)-peptide (His3 32/44) (His3-(13-25)-peptide) (His3 13/25) (Histatin 10) (Histatin-10) (Histatin-3 13/25); His3-(32-43)-peptide (His3 32-43) (His3-(13-24)-peptide) (His3 13/24) (Histatin 8) (Histatin-3 13/24) (Histatin-8); His3-(33-44)-peptide (His3 33/44) (His3-(14-25)-peptide) (His3 14/25) (Histatin-3 14/25); His3-(33-43)-peptide (His3 33/43) (His3-(14-24)-peptide) (His3 14/24) (Histatin-3 14/24); His3-(34-44)-peptide (His3 34/44) (His3-(15-25)-peptide) (His3 15/25) (Histatin-3 15/25); His3-(34-43)-peptide (His3 34/43) (His3-(15-24)-peptide) (His3 15/24) (Histatin-3 15/24); His3-(45-51)-peptide (His3 45/51) (His3-(26-32)-peptide) (His3 26/32) (Histatin-3 26/32); His3-(47-51)-peptide (His3 47/51) (His3-(28-32)-peptide) (His3 28/32) (Histatin-3 28/32); His3-(48-51)-peptide (His3 48/51) (His3-(29-32)-peptide) (His3 29/32) (Histatin-3 29/32)]	HTN3 HIS2	Homo sapiens (Human)	51
P17213	reviewed	BPI_HUMAN	Bactericidal permeability-increasing protein (BPI) (CAP 57)	BPI	Homo sapiens (Human)	487
P17697	reviewed	CLUS_BOVIN	Clusterin (Glycoprotein III) (GpIII) [Cleaved into: Clusterin beta chain; Clusterin alpha chain]	CLU	Bos taurus (Bovine)	439
P17977	reviewed	CATG_RAT	Cathepsin G (EC 3.4.21.20)	Ctsg	Rattus norvegicus (Rat)	250
P19171	reviewed	CHIB_ARATH	Basic endochitinase B (EC 3.2.1.14) (Pathogenesis-related protein 3) (AtChiB) (PR-3)	CHI-B PR3 At3g12500 MQC3.32 T2E22.18 T2E22_119	Arabidopsis thaliana (Mouse-ear cress)	335
P19660	reviewed	CTHL2_BOVIN	Cathelicidin-2 (Bactenecin-5) (Bac5) (PR-42)	CATHL2 BAC5	Bos taurus (Bovine)	176
P19661	reviewed	CTHL3_BOVIN	Cathelicidin-3 (Bactenecin-7) (Bac7) (PR-59)	CATHL3 BAC7	Bos taurus (Bovine)	190
P19957	reviewed	ELAF_HUMAN	Elafin (Elastase-specific inhibitor) (ESI) (Peptidase inhibitor 3) (PI-3) (Protease inhibitor WAP3) (Skin-derived antileukoproteinase) (SKALP) (WAP four-disulfide core domain protein 14)	PI3 WAP3 WFDC14	Homo sapiens (Human)	117
P22226	reviewed	CTHL1_BOVIN	Cathelicidin-1 (Bactenecin-1) (Bac1) (Cyclic dodecapeptide)	CATHL1 BAC1	Bos taurus (Bovine)	155
P22749	reviewed	GNLY_HUMAN	Granulysin (Lymphokine LAG-2) (Protein NKG5) (T-cell activation protein 519)	GNLY LAG2 NKG5 TLA519	Homo sapiens (Human)	145
P24091	reviewed	CHI2_TOBAC	Endochitinase B (CHN-B) (EC 3.2.1.14)	CHN50	Nicotiana tabacum (Common tobacco)	324
P24158	reviewed	PRTN3_HUMAN	Myeloblastin (EC 3.4.21.76) (AGP7) (C-ANCA antigen) (Leukocyte proteinase 3) (PR-3) (PR3) (Neutrophil proteinase 4) (NP-4) (P29) (Wegener autoantigen)	PRTN3 MBN	Homo sapiens (Human)	256
P24627	reviewed	TRFL_BOVIN	Lactotransferrin (Lactoferrin) (EC 3.4.21.-) [Cleaved into: Lactoferricin-B (Lfcin-B)]	LTF	Bos taurus (Bovine)	708
P25031	reviewed	REG3B_RAT	Regenerating islet-derived protein 3-beta (REG-3-beta) (Pancreatitis-associated protein 1) (Peptide 23) (REG-2) (Regenerating islet-derived protein III-beta) (Reg III-beta) [Cleaved into: Regenerating islet-derived protein 3-beta 16.5 kDa form; Regenerating islet-derived protein 3-beta 15 kDa form]	Reg3b Pap Pap1 Reg2	Rattus norvegicus (Rat)	175
P26339	reviewed	CMGA_MOUSE	Chromogranin-A (CgA) [Cleaved into: Pancreastatin; Beta-granin; WE-14; Catestatin; GE-25; Serpinin-RRG; Serpinin (AL26); p-Glu serpinin precursor]	Chga	Mus musculus (Mouse)	463
P27043	reviewed	ANGI_CHICK	Angiogenin (EC 3.1.27.-) (Ribonuclease A)	ANG	Gallus gallus (Chicken)	139
P28293	reviewed	CATG_MOUSE	Cathepsin G (EC 3.4.21.20) (Vimentin-specific protease) (VSP)	Ctsg	Mus musculus (Mouse)	261
P29022	reviewed	CHIA_MAIZE	Endochitinase A (EC 3.2.1.14) (ChitA) (Chitinase-A) (Seed chitinase A) (allergen Zea m 8)	CHIA CTA1	Zea mays (Maize)	280
P31107	reviewed	DRS2_PHYBI	Dermaseptin-B2 (DRS-B2) (Adenoregulin) (Dermaseptin BII)	ADR	Phyllomedusa bicolor (Two-colored leaf frog) (Rana bicolor)	81
P31482	reviewed	PA2GA_MOUSE	Phospholipase A2, membrane associated (EC 3.1.1.4) (Enhancing factor) (EF) (GIIC sPLA2) (Group IIA phospholipase A2) (Phosphatidylcholine 2-acylhydrolase 2A)	Pla2g2a	Mus musculus (Mouse)	146
P34690	reviewed	TBA2_CAEEL	Tubulin alpha-2 chain (EC 3.6.5.-)	tba-2 C47B2.3	Caenorhabditis elegans	448
P35030	reviewed	TRY3_HUMAN	Trypsin-3 (EC 3.4.21.4) (Brain trypsinogen) (Mesotrypsin) (Mesotrypsinogen) (Serine protease 3) (Serine protease 4) (Trypsin III) (Trypsin IV)	PRSS3 PRSS4 TRY3 TRY4	Homo sapiens (Human)	304
P35230	reviewed	REG3B_MOUSE	Regenerating islet-derived protein 3-beta (REG-3-beta) (Pancreatitis-associated protein 1) (Regenerating islet-derived protein III-beta) (Reg III-beta) [Cleaved into: Regenerating islet-derived protein 3-beta 16.5 kDa form; Regenerating islet-derived protein 3-beta 15 kDa form]	Reg3b Pap Pap1	Mus musculus (Mouse)	175
P36193	reviewed	DROS_DROME	Drosocin antimicrobial peptides [Cleaved into: Drosocin; Buletin (DIM 7) (IM7)]	Dro CG10816	Drosophila melanogaster (Fruit fly)	64
P37001	reviewed	PAGP_ECOLI	Lipid A palmitoyltransferase PagP (EC 2.3.1.251) (Lipid A acylation protein)	pagP crcA ybeG b0622 JW0617	Escherichia coli (strain K12)	186
P41797	reviewed	HSP71_CANAL	Heat shock protein HSP70 (SSA subfamily protein 1)	HSP70 HS71 SSA1 SSA4 CAALFM_C113480WA CaO19.12447 CaO19.4980	Candida albicans (strain SC5314 / ATCC MYA-2876) (Yeast)	656
P42820	reviewed	CHIP_BETVU	Acidic endochitinase SP2 (EC 3.2.1.14)	SP2	Beta vulgaris (Sugar beet)	288
P42854	reviewed	REG3G_RAT	Regenerating islet-derived protein 3-gamma (REG-3-gamma) (Pancreatitis-associated protein 3) (Regenerating islet-derived protein III-gamma) (Reg III-gamma) [Cleaved into: Regenerating islet-derived protein 3-gamma 16.5 kDa form; Regenerating islet-derived protein 3-gamma 15 kDa form]	Reg3g Pap3	Rattus norvegicus (Rat)	174
P43082	reviewed	HEVL_ARATH	Hevein-like preproprotein [Cleaved into: CB-HEL; CD-HEL (EC 3.1.-.-) (RNase)]	HEL At3g04720 F7O18.21	Arabidopsis thaliana (Mouse-ear cress)	212
P46158	reviewed	GLL2_CHICK	Gallinacin-2 (Gal-2) (Beta-defensin 2)	GAL2	Gallus gallus (Chicken)	64
P46587	reviewed	HSP72_CANAL	Heat shock protein SSA2 (SSA subfamily protein 2)	SSA2 SSA1 CAALFM_C104300CA CaO19.1065 CaO19.8667	Candida albicans (strain SC5314 / ATCC MYA-2876) (Yeast)	645
P49913	reviewed	CAMP_HUMAN	Cathelicidin antimicrobial peptide (18 kDa cationic antimicrobial protein) (CAP-18) (hCAP-18) [Cleaved into: Antibacterial peptide FALL-39 (FALL-39 peptide antibiotic); Antibacterial peptide LL-37; Antibacterial peptide KR-20; Antibacterial peptide LL-23; Antibacterial peptide LL-29; Antibacterial peptide KS-30; Antibacterial peptide RK-31; Antibacterial peptide FF-33]	CAMP CAP18 FALL39 HSD26	Homo sapiens (Human)	170
P51437	reviewed	CAMP_MOUSE	Cathelicidin antimicrobial peptide (Cathelin-like protein) (CLP) [Cleaved into: Cathelin-related antimicrobial peptide (Cramp)]	Camp Cnlp Cramp	Mus musculus (Mouse)	172
P52275	reviewed	TBB2_CAEEL	Tubulin beta-2 chain (Beta-2-tubulin)	tbb-2 C36E8.5	Caenorhabditis elegans	450
P55824	reviewed	FAF_DROME	Probable ubiquitin carboxyl-terminal hydrolase FAF (EC 3.4.19.12) (Protein fat facets) (Ubiquitin thioesterase FAF) (Ubiquitin-specific-processing protease FAF) (Deubiquitinating enzyme FAF)	faf CG1945	Drosophila melanogaster (Fruit fly)	2778
P56917	reviewed	TPA_RANTE	Temporin-1Ta (TA) (Temporin-A)		Rana temporaria (European common frog)	13
P57053	reviewed	H2BFS_HUMAN	Histone H2B type F-S (H2B-clustered histone 12 like) (H2B.S histone 1) (Histone H2B.s) (H2B/s)	H2BC12L H2BFS H2BS1	Homo sapiens (Human)	126
P57104	reviewed	TPL_RANTE	Temporin-1Tl (TL) (Temporin-L)		Rana temporaria (European common frog)	13
P59044	reviewed	NLRP6_HUMAN	NACHT, LRR and PYD domains-containing protein 6 (Angiotensin II/vasopressin receptor) (PYRIN-containing APAF1-like protein 5)	NLRP6 NALP6 PYPAF5	Homo sapiens (Human)	892
P59665	reviewed	DEF1_HUMAN	Neutrophil defensin 1 (Defensin, alpha 1) (HNP-1) (HP-1) (HP1) [Cleaved into: HP 1-56; Neutrophil defensin 2 (HNP-2) (HP-2) (HP2)]	DEFA1 DEF1 DEFA2 MRS; DEFA1B	Homo sapiens (Human)	94
P59827	reviewed	BPIB4_HUMAN	BPI fold-containing family B member 4 (Ligand-binding protein RY2G5) (Long palate, lung and nasal epithelium carcinoma-associated protein 4)	BPIFB4 C20orf186 LPLUNC4	Homo sapiens (Human)	614
P61507	reviewed	LYT1_HOGCA	M-lycotoxin-Hc1a (M-LCTX-Hc1a) (Lycotoxin I) (Lycotoxin-1)		Hogna carolinensis (Carolina wolf spider) (Lycosa carolinensis)	25
P61626	reviewed	LYSC_HUMAN	Lysozyme C (EC 3.2.1.17) (1,4-beta-N-acetylmuramidase C)	LYZ LZM	Homo sapiens (Human)	148
P62807	reviewed	H2B1C_HUMAN	Histone H2B type 1-C/E/F/G/I (Histone H2B.1 A) (Histone H2B.a) (H2B/a) (Histone H2B.g) (H2B/g) (Histone H2B.h) (H2B/h) (Histone H2B.k) (H2B/k) (Histone H2B.l) (H2B/l)	H2BC4 H2BFL HIST1H2BC; H2BC6 H2BFH HIST1H2BE; H2BC7 H2BFG HIST1H2BF; H2BC8 H2BFA HIST1H2BG; H2BC10 H2BFK HIST1H2BI	Homo sapiens (Human)	126
P76445	reviewed	LPXT_ECOLI	Lipid A 1-diphosphate synthase (EC 2.7.4.29) (Kdo(2)-lipid A phosphotransferase) (Undecaprenyl pyrophosphate:lipid A 1-phosphate phosphotransferase)	lpxT yeiU b2174 JW2162	Escherichia coli (strain K12)	237
P77398	reviewed	ARNA_ECOLI	Bifunctional polymyxin resistance protein ArnA (Polymyxin resistance protein PmrI) [Includes: UDP-4-amino-4-deoxy-L-arabinose formyltransferase (EC 2.1.2.13) (ArnAFT) (UDP-L-Ara4N formyltransferase); UDP-glucuronic acid oxidase, UDP-4-keto-hexauronic acid decarboxylating (EC 1.1.1.305) (ArnADH) (UDP-GlcUA decarboxylase) (UDP-glucuronic acid dehydrogenase)]	arnA pmrI yfbG b2255 JW2249	Escherichia coli (strain K12)	660
P79874	reviewed	TPB_RANTE	Temporin-1Tb (TB) (Temporin-B)		Rana temporaria (European common frog)	61
P81058	reviewed	PEN3A_PENVA	Penaeidin-3a (P3-a) (Pen-3a)		Penaeus vannamei (Whiteleg shrimp) (Litopenaeus vannamei)	82
P81605	reviewed	DCD_HUMAN	Dermcidin (EC 3.4.-.-) (Preproteolysin) [Cleaved into: Survival-promoting peptide; DCD-1]	DCD AIDD DSEP	Homo sapiens (Human)	110
P83080	reviewed	M1H1_BOMMX	Maximins 1/H1 [Cleaved into: Maximin-1 (Host defense peptide) (HDP); Maximin-H1 (Maximin-6)]		Bombina maxima (Giant fire-bellied toad) (Chinese red belly toad)	144
P83082	reviewed	M3H2_BOMMX	Maximins 3/H2 [Cleaved into: Maximin-3; Maximin-H2]		Bombina maxima (Giant fire-bellied toad) (Chinese red belly toad)	144
P85966	reviewed	AMP_TRIKH	Antimicrobial peptide 1b (WAMP-1b) (Antimicrobial peptide H1) (Tk-AMP-H1) [Cleaved into: Antimicrobial peptide 1a (WAMP-1a)]		Triticum kiharae (Wheat)	116
P93680	reviewed	CHIT_PERAE	Endochitinase (EC 3.2.1.14) (Allergen Pers a 1) (Allergen Prs a 1) (Chitin-binding avocado protein) (CBAP) (Class I chitinase) (PaI1) (allergen Pers a 1.0101)	chi1	Persea americana (Avocado)	326
P97361	reviewed	BPIA1_MOUSE	BPI fold-containing family A member 1 (Palate lung and nasal epithelium clone protein)	Bpifa1 Plunc Splunc1	Mus musculus (Mouse)	278
P9WFU7	reviewed	LYSX_MYCTU	Lysylphosphatidylglycerol biosynthesis bifunctional protein LysX [Includes: Lysine--tRNA ligase (EC 6.1.1.6) (Lysyl-tRNA synthetase) (LysRS); Phosphatidylglycerol lysyltransferase (EC 2.3.2.3) (Lysylphosphatidylglycerol synthetase) (LPG synthetase)]	lysX lysS2 lysU mprF Rv1640c MTCY06H11.04c	Mycobacterium tuberculosis (strain ATCC 25618 / H37Rv)	1172
P9WQI9	reviewed	BACA_MYCTU	Hydrophilic compounds import ATP-binding/permease protein BacA (EC 7.6.2.-) (Hydrophilic compounds ABC transporter BacA)	bacA Rv1819c MTCY1A11.24c	Mycobacterium tuberculosis (strain ATCC 25618 / H37Rv)	639
Q01524	reviewed	DEF6_HUMAN	Defensin-6 (Defensin, alpha 6)	DEFA6 DEF6	Homo sapiens (Human)	100
Q05538	reviewed	CHIC_SOLLC	Basic 30 kDa endochitinase (EC 3.2.1.14)	CHI9	Solanum lycopersicum (Tomato) (Lycopersicon esculentum)	322
Q06141	reviewed	REG3A_HUMAN	Regenerating islet-derived protein 3-alpha (REG-3-alpha) (Hepatointestinal pancreatic protein) (HIP/PAP) (Human proislet peptide) (HIP) (Pancreatitis-associated protein 1) (Regenerating islet-derived protein III-alpha) (Reg III-alpha) [Cleaved into: Regenerating islet-derived protein 3-alpha 16.5 kDa form; Regenerating islet-derived protein 3-alpha 15 kDa form]	REG3A HIP PAP PAP1	Homo sapiens (Human)	175
Q06890	reviewed	CLUS_MOUSE	Clusterin (Apolipoprotein J) (Apo-J) (Clustrin) (Sulfated glycoprotein 2) (SGP-2) [Cleaved into: Clusterin beta chain; Clusterin alpha chain]	Clu Apoj Msgp-2	Mus musculus (Mouse)	448
